{"componentChunkName":"component---src-templates-post-jsx","path":"/blog/year-review-2019","result":{"data":{"mdx":{"body":"function _extends() { _extends = Object.assign || function (target) { for (var i = 1; i < arguments.length; i++) { var source = arguments[i]; for (var key in source) { if (Object.prototype.hasOwnProperty.call(source, key)) { target[key] = source[key]; } } } return target; }; return _extends.apply(this, arguments); }\n\nfunction _objectWithoutProperties(source, excluded) { if (source == null) return {}; var target = _objectWithoutPropertiesLoose(source, excluded); var key, i; if (Object.getOwnPropertySymbols) { var sourceSymbolKeys = Object.getOwnPropertySymbols(source); for (i = 0; i < sourceSymbolKeys.length; i++) { key = sourceSymbolKeys[i]; if (excluded.indexOf(key) >= 0) continue; if (!Object.prototype.propertyIsEnumerable.call(source, key)) continue; target[key] = source[key]; } } return target; }\n\nfunction _objectWithoutPropertiesLoose(source, excluded) { if (source == null) return {}; var target = {}; var sourceKeys = Object.keys(source); var key, i; for (i = 0; i < sourceKeys.length; i++) { key = sourceKeys[i]; if (excluded.indexOf(key) >= 0) continue; target[key] = source[key]; } return target; }\n\n/* @jsx mdx */\nvar _frontmatter = {\n  \"title\": \"Year review 2019\",\n  \"coverFile\": \"./images/grad4.jpg\",\n  \"coverURL\": \"\",\n  \"author\": \"Fadee Kannah\",\n  \"authorTwitter\": \"@fadeenk\",\n  \"publisher\": \"MrKannah.com\",\n  \"dateModified\": \"2019-02-24T00:00:00.000Z\",\n  \"date\": \"2020-01-01T00:00:00.000Z\",\n  \"completed\": \"2020-01-01T00:00:00.000Z\",\n  \"category\": \"Personal\",\n  \"tags\": [\"YearReview\", \"Travel\", \"Business\", \"Work\"]\n};\n\nvar makeShortcode = function makeShortcode(name) {\n  return function MDXDefaultShortcode(props) {\n    console.warn(\"Component \" + name + \" was not imported, exported, or provided by MDXProvider as global scope\");\n    return mdx(\"div\", props);\n  };\n};\n\nvar layoutProps = {\n  _frontmatter: _frontmatter\n};\nvar MDXLayout = \"wrapper\";\nreturn function MDXContent(_ref) {\n  var components = _ref.components,\n      props = _objectWithoutProperties(_ref, [\"components\"]);\n\n  return mdx(MDXLayout, _extends({}, layoutProps, props, {\n    components: components,\n    mdxType: \"MDXLayout\"\n  }), mdx(\"h2\", {\n    \"id\": \"introduction\"\n  }, mdx(\"a\", _extends({\n    parentName: \"h2\"\n  }, {\n    \"href\": \"#introduction\",\n    \"aria-label\": \"introduction permalink\",\n    \"className\": \"anchor\"\n  }), mdx(\"svg\", _extends({\n    parentName: \"a\"\n  }, {\n    \"aria-hidden\": \"true\",\n    \"focusable\": \"false\",\n    \"height\": \"16\",\n    \"version\": \"1.1\",\n    \"viewBox\": \"0 0 16 16\",\n    \"width\": \"16\"\n  }), mdx(\"path\", _extends({\n    parentName: \"svg\"\n  }, {\n    \"fillRule\": \"evenodd\",\n    \"d\": \"M4 9h1v1H4c-1.5 0-3-1.69-3-3.5S2.55 3 4 3h4c1.45 0 3 1.69 3 3.5 0 1.41-.91 2.72-2 3.25V8.59c.58-.45 1-1.27 1-2.09C10 5.22 8.98 4 8 4H4c-.98 0-2 1.22-2 2.5S3 9 4 9zm9-3h-1v1h1c1 0 2 1.22 2 2.5S13.98 12 13 12H9c-.98 0-2-1.22-2-2.5 0-.83.42-1.64 1-2.09V6.25c-1.09.53-2 1.84-2 3.25C6 11.31 7.55 13 9 13h4c1.45 0 3-1.69 3-3.5S14.5 6 13 6z\"\n  })))), \"Introduction\"), mdx(\"p\", null, \"Last year I did a year review and I really enjoyed reflecting on it. I had decided that I will keep documenting each year's highlights. This year however I decided to do it slightly differently! Instead of waiting till the new year and spending a week or so trying to remember all the information, I wrote things down as they were happening. You can read the month by month highlights or skip to the \", mdx(\"a\", _extends({\n    parentName: \"p\"\n  }, {\n    \"href\": \"#summary\"\n  }), \"tl;dr section\"), \".\"), mdx(\"h2\", {\n    \"id\": \"month-by-month-breakdown\"\n  }, mdx(\"a\", _extends({\n    parentName: \"h2\"\n  }, {\n    \"href\": \"#month-by-month-breakdown\",\n    \"aria-label\": \"month by month breakdown permalink\",\n    \"className\": \"anchor\"\n  }), mdx(\"svg\", _extends({\n    parentName: \"a\"\n  }, {\n    \"aria-hidden\": \"true\",\n    \"focusable\": \"false\",\n    \"height\": \"16\",\n    \"version\": \"1.1\",\n    \"viewBox\": \"0 0 16 16\",\n    \"width\": \"16\"\n  }), mdx(\"path\", _extends({\n    parentName: \"svg\"\n  }, {\n    \"fillRule\": \"evenodd\",\n    \"d\": \"M4 9h1v1H4c-1.5 0-3-1.69-3-3.5S2.55 3 4 3h4c1.45 0 3 1.69 3 3.5 0 1.41-.91 2.72-2 3.25V8.59c.58-.45 1-1.27 1-2.09C10 5.22 8.98 4 8 4H4c-.98 0-2 1.22-2 2.5S3 9 4 9zm9-3h-1v1h1c1 0 2 1.22 2 2.5S13.98 12 13 12H9c-.98 0-2-1.22-2-2.5 0-.83.42-1.64 1-2.09V6.25c-1.09.53-2 1.84-2 3.25C6 11.31 7.55 13 9 13h4c1.45 0 3-1.69 3-3.5S14.5 6 13 6z\"\n  })))), \"Month by month breakdown\"), mdx(\"h3\", {\n    \"id\": \"january\"\n  }, mdx(\"a\", _extends({\n    parentName: \"h3\"\n  }, {\n    \"href\": \"#january\",\n    \"aria-label\": \"january permalink\",\n    \"className\": \"anchor\"\n  }), mdx(\"svg\", _extends({\n    parentName: \"a\"\n  }, {\n    \"aria-hidden\": \"true\",\n    \"focusable\": \"false\",\n    \"height\": \"16\",\n    \"version\": \"1.1\",\n    \"viewBox\": \"0 0 16 16\",\n    \"width\": \"16\"\n  }), mdx(\"path\", _extends({\n    parentName: \"svg\"\n  }, {\n    \"fillRule\": \"evenodd\",\n    \"d\": \"M4 9h1v1H4c-1.5 0-3-1.69-3-3.5S2.55 3 4 3h4c1.45 0 3 1.69 3 3.5 0 1.41-.91 2.72-2 3.25V8.59c.58-.45 1-1.27 1-2.09C10 5.22 8.98 4 8 4H4c-.98 0-2 1.22-2 2.5S3 9 4 9zm9-3h-1v1h1c1 0 2 1.22 2 2.5S13.98 12 13 12H9c-.98 0-2-1.22-2-2.5 0-.83.42-1.64 1-2.09V6.25c-1.09.53-2 1.84-2 3.25C6 11.31 7.55 13 9 13h4c1.45 0 3-1.69 3-3.5S14.5 6 13 6z\"\n  })))), \"January\"), mdx(\"p\", null, \"The first exciting event of the year was game night at Luke's place. We played a bunch of board games and it was a ton of fun! Especially when I and Luke played the trading card game \", mdx(\"a\", _extends({\n    parentName: \"p\"\n  }, {\n    \"href\": \"https://boardgamegeek.com/boardgame/54043/jaipur\"\n  }), \"Jaipur\"), \".\"), mdx(Gallery, {\n    photos: [{\n      src: gn1,\n      width: 50,\n      height: 28\n    }, {\n      src: gn2,\n      width: 50,\n      height: 28\n    }],\n    mdxType: \"Gallery\"\n  }), mdx(\"p\", null, \"A couple of weeks later my family and I decided to try a traditional Filipino meal. We tried the Fiesta Kamayan at the Villa Manila. The experience was great and the food was good except that it was way saltier than expected.\"), mdx(Gallery, {\n    photos: [{\n      src: kamayan1,\n      width: 50,\n      height: 28\n    }, {\n      src: kamayan2,\n      width: 50,\n      height: 28\n    }],\n    mdxType: \"Gallery\"\n  }), mdx(\"h3\", {\n    \"id\": \"february\"\n  }, mdx(\"a\", _extends({\n    parentName: \"h3\"\n  }, {\n    \"href\": \"#february\",\n    \"aria-label\": \"february permalink\",\n    \"className\": \"anchor\"\n  }), mdx(\"svg\", _extends({\n    parentName: \"a\"\n  }, {\n    \"aria-hidden\": \"true\",\n    \"focusable\": \"false\",\n    \"height\": \"16\",\n    \"version\": \"1.1\",\n    \"viewBox\": \"0 0 16 16\",\n    \"width\": \"16\"\n  }), mdx(\"path\", _extends({\n    parentName: \"svg\"\n  }, {\n    \"fillRule\": \"evenodd\",\n    \"d\": \"M4 9h1v1H4c-1.5 0-3-1.69-3-3.5S2.55 3 4 3h4c1.45 0 3 1.69 3 3.5 0 1.41-.91 2.72-2 3.25V8.59c.58-.45 1-1.27 1-2.09C10 5.22 8.98 4 8 4H4c-.98 0-2 1.22-2 2.5S3 9 4 9zm9-3h-1v1h1c1 0 2 1.22 2 2.5S13.98 12 13 12H9c-.98 0-2-1.22-2-2.5 0-.83.42-1.64 1-2.09V6.25c-1.09.53-2 1.84-2 3.25C6 11.31 7.55 13 9 13h4c1.45 0 3-1.69 3-3.5S14.5 6 13 6z\"\n  })))), \"February\"), mdx(\"p\", null, \"We finally got our new backend engineer Tim!! The hiring for the role took over a quarter to find the right fit. Funny thing, we hired Tim and literally two days later the whole dev team was leaving for the DevWeek conference. We had to stumble to get him a ticket and asked him to pay for flight and Airbnb! (CourseKey could not afford to cover anything other than the tickets)\"), mdx(\"p\", null, \"The CourseKey development and product teams attended the DevWeek conference in Oakland. We got to meet up with ex CourseKey engineer (Irving). It was a great time as we got to spend time together in addition to learning a few things from the conference. Of course, we cannot forget about all the free dev swag that we got.\"), mdx(\"p\", null, \"The main highlight of the trip for me was at the end of the conference. It was when we learned about an issue in production and the dev team was hotfixing the issue as our PM decided to upgrade our JIRA causing a bit of confusion. Additionally, I got to get a discount for gitKraken software and reported all the bugs and issues to the project managers at Atlassian regarding JIRA and BitBucket. You can learn more about my experience at the conference from my \", mdx(\"a\", _extends({\n    parentName: \"p\"\n  }, {\n    \"href\": \"./developer-week-conference-recap\"\n  }), \"recap post\"), \".\"), mdx(\"p\", null, \"On the 25th of February, I learned that our \", mdx(\"a\", _extends({\n    parentName: \"p\"\n  }, {\n    \"href\": \"https://patents.google.com/patent/US10212542B2/en?inventor=Fadee+Kannah\"\n  }), \"first patent\"), \" has been granted as of the 19th! We originally started working on the patent back in 2015 and had it filed in 2016. Being a patent holder was one of my life goals to accomplish. Since this goal is already achieved, I replaced it with getting a \", mdx(\"a\", _extends({\n    parentName: \"p\"\n  }, {\n    \"href\": \"https://patents.google.com/patent/US20190056494A1/en?inventor=Fadee+Kannah\"\n  }), \"second patent\"), \". Once is not enough for me and I already have the second one already filed and waiting for it to be granted.\"), mdx(Gallery, {\n    photos: [{\n      src: patent,\n      width: 695,\n      height: 869,\n      caption: mdx(\"p\", null, mdx(\"a\", {\n        href: \"https://patents.google.com/?inventor=Fadee+Kannah\"\n      }, \"All my patents\"))\n    }],\n    mdxType: \"Gallery\"\n  }), mdx(\"p\", null, \"Since I was back at SDSU, I decided to be a bit more involved and attend the interesting events. I learned about the Aztec Mentorship Program and attended the talk/networking event. I got to meet a few mentors and I decided to shadow one of them. This was my first step working on a long term goal.\"), mdx(Gallery, {\n    photos: [{\n      src: amp1,\n      width: 983,\n      height: 737\n    }],\n    mdxType: \"Gallery\"\n  }), mdx(\"p\", null, \"Since we moved offices at CourseKey back in October of last year, our agent got us a reservation to brew our own beer. We brew it in February and bottle it in March. This is becoming kind of a tradition as we move offices, we brew new beer. The first beer we brewed was an IPL. This time we did something different (an American wheat/rye beer) more fruity and lighter so it is easier to drink.\"), mdx(Gallery, {\n    photos: [{\n      src: beer,\n      width: 1024,\n      height: 473\n    }],\n    mdxType: \"Gallery\"\n  }), mdx(Gallery, {\n    photos: [{\n      src: beer1,\n      width: 300,\n      height: 560\n    }, {\n      src: beer2,\n      width: 300,\n      height: 560\n    }, {\n      src: beer3,\n      width: 1200,\n      height: 1600\n    }, {\n      src: beer4,\n      width: 1080,\n      height: 1080\n    }, {\n      src: beer5,\n      width: 300,\n      height: 600\n    }],\n    mdxType: \"Gallery\"\n  }), mdx(\"h3\", {\n    \"id\": \"march\"\n  }, mdx(\"a\", _extends({\n    parentName: \"h3\"\n  }, {\n    \"href\": \"#march\",\n    \"aria-label\": \"march permalink\",\n    \"className\": \"anchor\"\n  }), mdx(\"svg\", _extends({\n    parentName: \"a\"\n  }, {\n    \"aria-hidden\": \"true\",\n    \"focusable\": \"false\",\n    \"height\": \"16\",\n    \"version\": \"1.1\",\n    \"viewBox\": \"0 0 16 16\",\n    \"width\": \"16\"\n  }), mdx(\"path\", _extends({\n    parentName: \"svg\"\n  }, {\n    \"fillRule\": \"evenodd\",\n    \"d\": \"M4 9h1v1H4c-1.5 0-3-1.69-3-3.5S2.55 3 4 3h4c1.45 0 3 1.69 3 3.5 0 1.41-.91 2.72-2 3.25V8.59c.58-.45 1-1.27 1-2.09C10 5.22 8.98 4 8 4H4c-.98 0-2 1.22-2 2.5S3 9 4 9zm9-3h-1v1h1c1 0 2 1.22 2 2.5S13.98 12 13 12H9c-.98 0-2-1.22-2-2.5 0-.83.42-1.64 1-2.09V6.25c-1.09.53-2 1.84-2 3.25C6 11.31 7.55 13 9 13h4c1.45 0 3-1.69 3-3.5S14.5 6 13 6z\"\n  })))), \"March\"), mdx(\"p\", null, \"March was even busier! It started with my new website launch! I finally put together a website that includes a blog. \", mdx(\"a\", _extends({\n    parentName: \"p\"\n  }, {\n    \"href\": \"https://medium.com/\"\n  }), \"Medium\"), \" was extremely annoying for me so since the beginning of the year, I rebuilt my website from the ground up to allow me to do whatever I want.\"), mdx(\"p\", null, \"A couple of days later, I found \", mdx(\"a\", _extends({\n    parentName: \"p\"\n  }, {\n    \"href\": \"./the-post-that-changed-everything\"\n  }), \"the post that changed everything\"), \". Soon after I attended the MESA leadership conference. I was hoping the conference would be similar to when I first attended in 2014. Here is \", mdx(\"a\", _extends({\n    parentName: \"p\"\n  }, {\n    \"href\": \"./mesa-student-leadership-2019-recap\"\n  }), \"the recap of the conference\"), \".\"), mdx(Gallery, {\n    photos: [{\n      src: FBPost,\n      width: 464,\n      height: 325,\n      caption: mdx(\"p\", null, mdx(\"a\", {\n        href: \"./the-post-that-changed-everything\"\n      }, \"The post that changed everything\"))\n    }],\n    mdxType: \"Gallery\"\n  }), mdx(\"p\", null, \"My website was not the only website launch that month. We also launched a new and updated CourseKey website. That included moving our website domain to \", mdx(\"a\", _extends({\n    parentName: \"p\"\n  }, {\n    \"href\": \"https://coursekey.com/\"\n  }), \"coursekey.com\"), \" no \\\"the\\\" or \\\"education\\\", just a simple CourseKey. It took us a while to get the domain but we finally got it.\"), mdx(\"p\", null, \"To wrap up March, My family and I went on a trip to Los Angeles. We got to spend two days at Univeral Studios. Followed by a day in the Getty Center and Villa. Although Univeral Studios was great, I enjoyed the Getty museums way more.\"), mdx(Gallery, {\n    photos: [{\n      src: uni1,\n      width: 50,\n      height: 35\n    }, {\n      src: uni2,\n      width: 50,\n      height: 35\n    }, {\n      src: uni3,\n      width: 55,\n      height: 40\n    }, {\n      src: uni4,\n      width: 45,\n      height: 60\n    }, {\n      src: uni5,\n      width: 50,\n      height: 90\n    }, {\n      src: uni6,\n      width: 50,\n      height: 90\n    }, {\n      src: uni7,\n      width: 2016,\n      height: 980\n    }, {\n      src: uni8,\n      width: 2016,\n      height: 1512\n    }, {\n      src: uni9,\n      width: 2016,\n      height: 1512\n    }, {\n      src: uni10,\n      width: 2040,\n      height: 1148\n    }, {\n      src: uni11,\n      width: 2016,\n      height: 1512\n    }, {\n      src: uni12,\n      width: 2016,\n      height: 1512\n    }, {\n      src: uni13,\n      width: 2016,\n      height: 1512\n    }, {\n      src: uni14,\n      width: 2016,\n      height: 1512\n    }, {\n      src: uni15,\n      width: 2016,\n      height: 1512\n    }, {\n      src: uni16,\n      width: 720,\n      height: 960\n    }],\n    mdxType: \"Gallery\"\n  }), mdx(\"h3\", {\n    \"id\": \"april\"\n  }, mdx(\"a\", _extends({\n    parentName: \"h3\"\n  }, {\n    \"href\": \"#april\",\n    \"aria-label\": \"april permalink\",\n    \"className\": \"anchor\"\n  }), mdx(\"svg\", _extends({\n    parentName: \"a\"\n  }, {\n    \"aria-hidden\": \"true\",\n    \"focusable\": \"false\",\n    \"height\": \"16\",\n    \"version\": \"1.1\",\n    \"viewBox\": \"0 0 16 16\",\n    \"width\": \"16\"\n  }), mdx(\"path\", _extends({\n    parentName: \"svg\"\n  }, {\n    \"fillRule\": \"evenodd\",\n    \"d\": \"M4 9h1v1H4c-1.5 0-3-1.69-3-3.5S2.55 3 4 3h4c1.45 0 3 1.69 3 3.5 0 1.41-.91 2.72-2 3.25V8.59c.58-.45 1-1.27 1-2.09C10 5.22 8.98 4 8 4H4c-.98 0-2 1.22-2 2.5S3 9 4 9zm9-3h-1v1h1c1 0 2 1.22 2 2.5S13.98 12 13 12H9c-.98 0-2-1.22-2-2.5 0-.83.42-1.64 1-2.09V6.25c-1.09.53-2 1.84-2 3.25C6 11.31 7.55 13 9 13h4c1.45 0 3-1.69 3-3.5S14.5 6 13 6z\"\n  })))), \"April\"), mdx(\"p\", null, \"April was eventful, literally! The first event, I attended was the Entrepreneurship organization's event for company acquisitions. This event was fun as I got to connect with other founders and learn about the process of selling/buying companies.\"), mdx(\"p\", null, \"The ASU GSV education conference happened in early April. This conference is where I got to see Bill Gates speak back in 2016. I did not attend this year either, due to my busy schedule and everything going on. However, I still got to network with people, thanks to Luke who got me into a few networking after-parties after the conference. I attended Kaplan's, Learn Capital's and Entangled's parties. To summarize the parties, there were a lot of successful people, lots of great stories and free food!\"), mdx(\"p\", null, \"Also, I learned about the Coronado flower show event which was nice. The best part about this event was the adjacent event the Coronado annual book sale! The book sale was amazing you get to grab books in great condition for $1-$5.\"), mdx(Gallery, {\n    photos: [{\n      src: flower1,\n      width: 2016,\n      height: 1512\n    }, {\n      src: flower2,\n      width: 2016,\n      height: 1512\n    }, {\n      src: flower3,\n      width: 716,\n      height: 960\n    }, {\n      src: flower4,\n      width: 2016,\n      height: 1512\n    }, {\n      src: flower5,\n      width: 2016,\n      height: 1512\n    }],\n    mdxType: \"Gallery\"\n  }), mdx(\"p\", null, \"Additionally, we cannot forget about giving back. This year was my first time volunteering for the Annual Children's Book Party. It was a great experience, here is \", mdx(\"a\", _extends({\n    parentName: \"p\"\n  }, {\n    \"href\": \"./the-35th-annual-childrens-book-party\"\n  }), \"the recap\"), \".\"), mdx(\"p\", null, \"To wrap up April's events and since \", mdx(\"a\", _extends({\n    parentName: \"p\"\n  }, {\n    \"href\": \"./my-college-journey\"\n  }), \"my university journey\"), \" was coming to an end. I was invited to attend the graduation ceremonies for the Educational Opportunity Program (EOP) and the Mathematics, Engineering, Science Achievement (MESA) program.\"), mdx(Gallery, {\n    photos: [{\n      src: eop1,\n      width: 2016,\n      height: 1512\n    }, {\n      src: eop2,\n      width: 2016,\n      height: 1512\n    }, {\n      src: eop3,\n      width: 716,\n      height: 960\n    }, {\n      src: eop4,\n      width: 1620,\n      height: 1080\n    }],\n    mdxType: \"Gallery\"\n  }), mdx(\"h3\", {\n    \"id\": \"may\"\n  }, mdx(\"a\", _extends({\n    parentName: \"h3\"\n  }, {\n    \"href\": \"#may\",\n    \"aria-label\": \"may permalink\",\n    \"className\": \"anchor\"\n  }), mdx(\"svg\", _extends({\n    parentName: \"a\"\n  }, {\n    \"aria-hidden\": \"true\",\n    \"focusable\": \"false\",\n    \"height\": \"16\",\n    \"version\": \"1.1\",\n    \"viewBox\": \"0 0 16 16\",\n    \"width\": \"16\"\n  }), mdx(\"path\", _extends({\n    parentName: \"svg\"\n  }, {\n    \"fillRule\": \"evenodd\",\n    \"d\": \"M4 9h1v1H4c-1.5 0-3-1.69-3-3.5S2.55 3 4 3h4c1.45 0 3 1.69 3 3.5 0 1.41-.91 2.72-2 3.25V8.59c.58-.45 1-1.27 1-2.09C10 5.22 8.98 4 8 4H4c-.98 0-2 1.22-2 2.5S3 9 4 9zm9-3h-1v1h1c1 0 2 1.22 2 2.5S13.98 12 13 12H9c-.98 0-2-1.22-2-2.5 0-.83.42-1.64 1-2.09V6.25c-1.09.53-2 1.84-2 3.25C6 11.31 7.55 13 9 13h4c1.45 0 3-1.69 3-3.5S14.5 6 13 6z\"\n  })))), \"May\"), mdx(\"p\", null, \"Since CourseKey won the San Diego Venture Group's Cool Companies award for the third time, we were invited to table our company for investors. This year Luke had a conflict, so I took over and did the tabling. Although I enjoyed it, I confirmed for sure that I don't want to be doing this kind of event that often. My voice literally cracked 4-6 times while I was speaking to people. I talked for what felt like a week's worth in just a few hours. On the plus side, the view was amazing!\"), mdx(Gallery, {\n    photos: [{\n      src: sdvg1,\n      width: 960,\n      height: 540\n    }, {\n      src: sdvg2,\n      width: 960,\n      height: 540\n    }],\n    mdxType: \"Gallery\"\n  }), mdx(\"p\", null, \"As for school, my team and I got to demo the electrical bike that we built. I was in charge of building a companion progressive web app. The app is a mix of google maps in biking mode (shows where bike lanes are) and a weather app. The app is live and accessible \", mdx(\"a\", _extends({\n    parentName: \"p\"\n  }, {\n    \"href\": \"/490/\"\n  }), \"here\"), \".\"), mdx(Gallery, {\n    photos: [{\n      src: senior0,\n      width: 3464,\n      height: 2309\n    }, {\n      src: senior1,\n      width: 418,\n      height: 830\n    }, {\n      src: senior2,\n      width: 720,\n      height: 1480\n    }],\n    mdxType: \"Gallery\"\n  }), mdx(\"p\", null, \"Also, May is the graduation season! Since I finally took my last two classes, I officially walked this may. To celebrate graduation my friends and I decided to go for Brazilian BBQ, however since we are always looking for a deal we decided to go to Mr. Pampas in Tijuana, Mexico. Although we crossed the border we, did not get the famous street tacos! This was upsetting for us, so we decided to go back and get tacos two days later. We went to the most famous taco place, Taqueria Franc.\"), mdx(Gallery, {\n    photos: [{\n      src: grad1,\n      width: 1837,\n      height: 1225\n    }, {\n      src: grad2,\n      width: 1980,\n      height: 1116\n    }, {\n      src: grad3,\n      width: 716,\n      height: 960\n    }, {\n      src: grad4,\n      width: 2016,\n      height: 1512\n    }, {\n      src: grad5,\n      width: 2016,\n      height: 1512\n    }, {\n      src: grad6,\n      width: 1920,\n      height: 1080\n    }, {\n      src: grad7,\n      width: 960,\n      height: 640\n    }],\n    mdxType: \"Gallery\"\n  }), mdx(Gallery, {\n    photos: [{\n      src: pampas1,\n      width: 960,\n      height: 454\n    }, {\n      src: pampas2,\n      width: 960,\n      height: 495\n    }],\n    mdxType: \"Gallery\"\n  }), mdx(\"p\", null, \"Additionally, I got invited to my friend Nathan's book launch party. He published his book \", mdx(\"a\", _extends({\n    parentName: \"p\"\n  }, {\n    \"href\": \"https://www.amazon.com/Ecommerce-Millionaires-Underground-Playbook-Eight-Figure/dp/0578402920\"\n  }), \"Ecommerce Millionaires\"), \". I got to tour Sourcify's office and hang out with friends and made a few new ones.\"), mdx(\"p\", null, \"This year I decided to speak at San Diego Startup Week. After reviewing the agenda, I noticed a lack of technical content. I decided to present on a topic that would have helped CourseKey in the early stages. Here is \", mdx(\"a\", _extends({\n    parentName: \"p\"\n  }, {\n    \"href\": \"./san-diego-start-up-week-2019-talk\"\n  }), \"the full recap of my talk\"), \".\"), mdx(\"h3\", {\n    \"id\": \"june\"\n  }, mdx(\"a\", _extends({\n    parentName: \"h3\"\n  }, {\n    \"href\": \"#june\",\n    \"aria-label\": \"june permalink\",\n    \"className\": \"anchor\"\n  }), mdx(\"svg\", _extends({\n    parentName: \"a\"\n  }, {\n    \"aria-hidden\": \"true\",\n    \"focusable\": \"false\",\n    \"height\": \"16\",\n    \"version\": \"1.1\",\n    \"viewBox\": \"0 0 16 16\",\n    \"width\": \"16\"\n  }), mdx(\"path\", _extends({\n    parentName: \"svg\"\n  }, {\n    \"fillRule\": \"evenodd\",\n    \"d\": \"M4 9h1v1H4c-1.5 0-3-1.69-3-3.5S2.55 3 4 3h4c1.45 0 3 1.69 3 3.5 0 1.41-.91 2.72-2 3.25V8.59c.58-.45 1-1.27 1-2.09C10 5.22 8.98 4 8 4H4c-.98 0-2 1.22-2 2.5S3 9 4 9zm9-3h-1v1h1c1 0 2 1.22 2 2.5S13.98 12 13 12H9c-.98 0-2-1.22-2-2.5 0-.83.42-1.64 1-2.09V6.25c-1.09.53-2 1.84-2 3.25C6 11.31 7.55 13 9 13h4c1.45 0 3-1.69 3-3.5S14.5 6 13 6z\"\n  })))), \"June\"), mdx(\"p\", null, \"As Luke likes to say, your network is your net worth. So I started June by attending a networking event hosted by SDSU alumna. Most attendees were graduates or people who work in the IT (Information Technology) and/or IMS (Information management system) industries.\"), mdx(\"p\", null, \"I got to connect and hang out with some of my engineering friends from SDSU. We got together and did what engineers do... have fun the nerdy way! First, we played HAM Radio fox hunt in the big backyard of my friend's place. Got to see a homemade 3D printer, play around with a Stirling engine, had lots of fun conversations (how to make liquid oxygen, rocket fuel and so on...). Then wrapped it up with a round of homemade/engineered laser tag!\"), mdx(Gallery, {\n    photos: [{\n      src: state1,\n      width: 492,\n      height: 874\n    }, {\n      src: state2,\n      width: 492,\n      height: 874\n    }, {\n      src: state3,\n      width: 492,\n      height: 874\n    }, {\n      src: state4,\n      width: 492,\n      height: 874\n    }, {\n      src: state5,\n      width: 960,\n      height: 540\n    }, {\n      src: state6,\n      width: 492,\n      height: 874\n    }],\n    mdxType: \"Gallery\"\n  }), mdx(\"p\", null, \"Additionally, June is the start of the first contact for the new students at SDSU. This includes the EOP program's first contact. This year I volunteered for EOP and assisted in the first contact event.\"), mdx(\"p\", null, \"In the middle of the month, I finally received my diploma! Also, I got invited to the Knights of Columbus Mar Toma Council Graduation party hosted by the Chaldean church in El Cajon.\"), mdx(Gallery, {\n    photos: [{\n      src: grad21,\n      width: 2016,\n      height: 1512\n    }, {\n      src: grad22,\n      width: 716,\n      height: 960\n    }, {\n      src: grad23,\n      width: 2016,\n      height: 1512\n    }, {\n      src: grad24,\n      width: 360,\n      height: 240\n    }],\n    mdxType: \"Gallery\"\n  }), mdx(\"p\", null, \"After ten years of being in San Diego, I finally attended the San Diego county fair in Del Mar. I got VIP (employee) access, which means I get in for FREE thanks to my friend who works there. My friends and I got to enjoy the fair along with the food of course. We ended the day with an epic fully loaded FREE ice cream sundae.\"), mdx(Gallery, {\n    photos: [{\n      src: fair1,\n      width: 492,\n      height: 874\n    }, {\n      src: fair2,\n      width: 960,\n      height: 541\n    }, {\n      src: fair3,\n      width: 960,\n      height: 454\n    }, {\n      src: fair4,\n      width: 492,\n      height: 874\n    }],\n    mdxType: \"Gallery\"\n  }), mdx(\"p\", null, \"The weather in San Diego had not been great! On the last day of the month, we finally got to use our Aquatica tickets. We got to enjoy the sun and water.\"), mdx(\"h3\", {\n    \"id\": \"july\"\n  }, mdx(\"a\", _extends({\n    parentName: \"h3\"\n  }, {\n    \"href\": \"#july\",\n    \"aria-label\": \"july permalink\",\n    \"className\": \"anchor\"\n  }), mdx(\"svg\", _extends({\n    parentName: \"a\"\n  }, {\n    \"aria-hidden\": \"true\",\n    \"focusable\": \"false\",\n    \"height\": \"16\",\n    \"version\": \"1.1\",\n    \"viewBox\": \"0 0 16 16\",\n    \"width\": \"16\"\n  }), mdx(\"path\", _extends({\n    parentName: \"svg\"\n  }, {\n    \"fillRule\": \"evenodd\",\n    \"d\": \"M4 9h1v1H4c-1.5 0-3-1.69-3-3.5S2.55 3 4 3h4c1.45 0 3 1.69 3 3.5 0 1.41-.91 2.72-2 3.25V8.59c.58-.45 1-1.27 1-2.09C10 5.22 8.98 4 8 4H4c-.98 0-2 1.22-2 2.5S3 9 4 9zm9-3h-1v1h1c1 0 2 1.22 2 2.5S13.98 12 13 12H9c-.98 0-2-1.22-2-2.5 0-.83.42-1.64 1-2.09V6.25c-1.09.53-2 1.84-2 3.25C6 11.31 7.55 13 9 13h4c1.45 0 3-1.69 3-3.5S14.5 6 13 6z\"\n  })))), \"July\"), mdx(\"p\", null, \"Early in the month, I traveled to Minnesota for work. I got to visit the Mall of America and enjoy some VR experiences.\"), mdx(Gallery, {\n    photos: [{\n      src: mall1,\n      width: 1920,\n      height: 1080\n    }, {\n      src: mall2,\n      width: 1920,\n      height: 1080\n    }, {\n      src: mall3,\n      width: 1920,\n      height: 1080\n    }, {\n      src: mall4,\n      width: 495,\n      height: 960\n    }],\n    mdxType: \"Gallery\"\n  }), mdx(YouTube, {\n    videoId: \"2xx-rg9zlZU\",\n    mdxType: \"YouTube\"\n  }), mdx(\"p\", null, \"Once I was back from my trip, I continued focusing on my network. I set up my own CRM with \", mdx(\"a\", _extends({\n    parentName: \"p\"\n  }, {\n    \"href\": \"https://www.hubspot.com/\"\n  }), \"HubSpot\"), \" (Which did not do what I needed so I replaced it with \", mdx(\"a\", _extends({\n    parentName: \"p\"\n  }, {\n    \"href\": \"https://airtable.com/\"\n  }), \"Airtable\"), \", which did not work either). Throughout the month, I reached out and got in touch with some people in my network starting with the CEO at CourseKey and followed by\"), mdx(\"ul\", null, mdx(\"li\", {\n    parentName: \"ul\"\n  }, \"Software Engineer at Qualcomm\"), mdx(\"li\", {\n    parentName: \"ul\"\n  }, \"Communication Engineer at Northrop\"), mdx(\"li\", {\n    parentName: \"ul\"\n  }, \"CTO at Sourcify\"), mdx(\"li\", {\n    parentName: \"ul\"\n  }, \"Scrum Master at MalwareBytes\"), mdx(\"li\", {\n    parentName: \"ul\"\n  }, \"Project Manager at Micro Focus (HP Enterprise)\"), mdx(\"li\", {\n    parentName: \"ul\"\n  }, \"VP of Engineering at Sony\"), mdx(\"li\", {\n    parentName: \"ul\"\n  }, \"Senior Software Engineer at Twilio (formally worked at Sony)\"), mdx(\"li\", {\n    parentName: \"ul\"\n  }, \"Senior Software Architect/ VP of Engineering/ Tech lead at varies companies\"), mdx(\"li\", {\n    parentName: \"ul\"\n  }, \"Senior Software Engineer at a Japanese bank\")), mdx(\"h3\", {\n    \"id\": \"august\"\n  }, mdx(\"a\", _extends({\n    parentName: \"h3\"\n  }, {\n    \"href\": \"#august\",\n    \"aria-label\": \"august permalink\",\n    \"className\": \"anchor\"\n  }), mdx(\"svg\", _extends({\n    parentName: \"a\"\n  }, {\n    \"aria-hidden\": \"true\",\n    \"focusable\": \"false\",\n    \"height\": \"16\",\n    \"version\": \"1.1\",\n    \"viewBox\": \"0 0 16 16\",\n    \"width\": \"16\"\n  }), mdx(\"path\", _extends({\n    parentName: \"svg\"\n  }, {\n    \"fillRule\": \"evenodd\",\n    \"d\": \"M4 9h1v1H4c-1.5 0-3-1.69-3-3.5S2.55 3 4 3h4c1.45 0 3 1.69 3 3.5 0 1.41-.91 2.72-2 3.25V8.59c.58-.45 1-1.27 1-2.09C10 5.22 8.98 4 8 4H4c-.98 0-2 1.22-2 2.5S3 9 4 9zm9-3h-1v1h1c1 0 2 1.22 2 2.5S13.98 12 13 12H9c-.98 0-2-1.22-2-2.5 0-.83.42-1.64 1-2.09V6.25c-1.09.53-2 1.84-2 3.25C6 11.31 7.55 13 9 13h4c1.45 0 3-1.69 3-3.5S14.5 6 13 6z\"\n  })))), \"August\"), mdx(\"p\", null, \"Started the month by having a game night at Luke's new place.\"), mdx(Gallery, {\n    photos: [{\n      src: gn21,\n      width: 960,\n      height: 540\n    }, {\n      src: gn22,\n      width: 960,\n      height: 540\n    }],\n    mdxType: \"Gallery\"\n  }), mdx(\"p\", null, \"Soon after it was vacation time! Last year my family and I enjoyed our cruise to Ensenada so much that we decided to do it again. However this time we took the rest of the family not just my immediate family.\"), mdx(Gallery, {\n    photos: [{\n      src: cruise1,\n      width: 2016,\n      height: 1512\n    }, {\n      src: cruise2,\n      width: 2016,\n      height: 1512\n    }, {\n      src: cruise3,\n      width: 2016,\n      height: 1512\n    }, {\n      src: cruise4,\n      width: 2016,\n      height: 1512\n    }, {\n      src: cruise5,\n      width: 2016,\n      height: 1512\n    }, {\n      src: cruise6,\n      width: 2016,\n      height: 1512\n    }, {\n      src: cruise7,\n      width: 2016,\n      height: 1512\n    }, {\n      src: cruise8,\n      width: 2016,\n      height: 1512\n    }, {\n      src: cruise9,\n      width: 2016,\n      height: 1512\n    }],\n    mdxType: \"Gallery\"\n  }), mdx(\"p\", null, \"After the cruise, we went to Los Angeles. First stop there was universal studios, followed by Korean BBQ, a walk Hollywood main street and wrapped it up with the museum of illusions.\"), mdx(Gallery, {\n    photos: [{\n      src: cruise10,\n      width: 716,\n      height: 960\n    }, {\n      src: cruise11,\n      width: 2016,\n      height: 1512\n    }, {\n      src: cruise12,\n      width: 2016,\n      height: 1512\n    }, {\n      src: cruise13,\n      width: 2016,\n      height: 1512\n    }, {\n      src: cruise14,\n      width: 2016,\n      height: 1512\n    }, {\n      src: cruise15,\n      width: 716,\n      height: 960\n    }],\n    mdxType: \"Gallery\"\n  }), mdx(\"p\", null, \"Finally, before the month ended, we celebrated \", mdx(\"a\", _extends({\n    parentName: \"p\"\n  }, {\n    \"href\": \"https://www.edsurge.com/news/2019-07-31-coursekey-raises-5-million-to-digitize-the-college-classroom?fbclid=IwAR1rcIyqOuT9ANl7LCENqRgDjKaAt7q4h_YYEJhmAJRv8ctWfaQKCyjVvRo\"\n  }), \"CourseKey's fundraising\"), \" by doing a San Diego Cruise followed by some bar hopping and games.\"), mdx(Gallery, {\n    photos: [{\n      src: ck1,\n      width: 603,\n      height: 803\n    }, {\n      src: ck2,\n      width: 656,\n      height: 874\n    }, {\n      src: ck3,\n      width: 656,\n      height: 874\n    }, {\n      src: ck4,\n      width: 960,\n      height: 720\n    }, {\n      src: ck5,\n      width: 960,\n      height: 720\n    }],\n    mdxType: \"Gallery\"\n  }), mdx(\"h3\", {\n    \"id\": \"september\"\n  }, mdx(\"a\", _extends({\n    parentName: \"h3\"\n  }, {\n    \"href\": \"#september\",\n    \"aria-label\": \"september permalink\",\n    \"className\": \"anchor\"\n  }), mdx(\"svg\", _extends({\n    parentName: \"a\"\n  }, {\n    \"aria-hidden\": \"true\",\n    \"focusable\": \"false\",\n    \"height\": \"16\",\n    \"version\": \"1.1\",\n    \"viewBox\": \"0 0 16 16\",\n    \"width\": \"16\"\n  }), mdx(\"path\", _extends({\n    parentName: \"svg\"\n  }, {\n    \"fillRule\": \"evenodd\",\n    \"d\": \"M4 9h1v1H4c-1.5 0-3-1.69-3-3.5S2.55 3 4 3h4c1.45 0 3 1.69 3 3.5 0 1.41-.91 2.72-2 3.25V8.59c.58-.45 1-1.27 1-2.09C10 5.22 8.98 4 8 4H4c-.98 0-2 1.22-2 2.5S3 9 4 9zm9-3h-1v1h1c1 0 2 1.22 2 2.5S13.98 12 13 12H9c-.98 0-2-1.22-2-2.5 0-.83.42-1.64 1-2.09V6.25c-1.09.53-2 1.84-2 3.25C6 11.31 7.55 13 9 13h4c1.45 0 3-1.69 3-3.5S14.5 6 13 6z\"\n  })))), \"September\"), mdx(\"p\", null, \"The month where I got to spend my time with old and new friends. It started with Korean BBQ with Luke, this time a different spot! Those dinners are always great. Because we finally get to catch up and have conversions about things other than work (work is still involved but at least it is not the only thing we talk about).\"), mdx(\"p\", null, \"A couple of days later, by some miracle, a group of my high school friends and I got together for dinner. After finishing our dinner and we were ready to leave we ran into another friend in the parking lot and ended up hanging out for hours!\"), mdx(\"p\", null, \"After four and a half years, Ming, our original CourseKey backend engineer, was finally back with the team! Ming is one of the core members who helped start CourseKey and his name is on the patent.\"), mdx(\"p\", null, \"Another high school/college group of friends decided to get together. This time we went to the famous \", mdx(\"a\", _extends({\n    parentName: \"p\"\n  }, {\n    \"href\": \"https://flinnsprings.grandolebbq.com/\"\n  }), \"Grand Ole BQQ\"), \". It was featured on Guy Fieri's Diners, Drive-Ins, and Dives. The food was good just it was not a good idea for dinner.\"), mdx(\"p\", null, \"The next day I got to go on a boat! Nathan invited me and Luke to join him and his CTO and friend on a private boat. It was a great time! We got to go really really fast, jump into the ocean for a swim, I got to drive the boat for a bit and enjoyed the company. Sadly, most of the pictures we took got lost.\"), mdx(Gallery, {\n    photos: [{\n      src: boat1,\n      width: 492,\n      height: 874\n    }, {\n      src: boat2,\n      width: 960,\n      height: 540\n    }, {\n      src: boat3,\n      width: 946,\n      height: 960\n    }, {\n      src: boat4,\n      width: 656,\n      height: 874\n    }],\n    mdxType: \"Gallery\"\n  }), mdx(\"p\", null, \"Since some of my friends are doing graduate school or were considering it, so I started to consider it as well. I want to keep learning and getting better, so I started investigating doing an MBA. At the same time, another friend at SDSU invited me to the Graduate Student Association event at Aztec Lanes. I snuck into the event (graduate students only) and asked about the program. I learned that it will not be the path for me, especially after talking to other executives in my network.\"), mdx(\"p\", null, \"Again another high school group got together! This time we did a bonfire at the beach, the weather was perfect for it. We enjoyed great conversations and lots of through backs. From playing high school time music to playing old cartoon intro songs in Arabic!\"), mdx(\"p\", null, \"Before the month ended, I got an invite for the Middle Eastern Student Union @ SDSU bonfire. I attended the event and it was nice to meet new people. However, the weather was not great (it started raining). Additionally, it was bad timing for me so I had to leave earlier than I liked.\"), mdx(\"h3\", {\n    \"id\": \"october\"\n  }, mdx(\"a\", _extends({\n    parentName: \"h3\"\n  }, {\n    \"href\": \"#october\",\n    \"aria-label\": \"october permalink\",\n    \"className\": \"anchor\"\n  }), mdx(\"svg\", _extends({\n    parentName: \"a\"\n  }, {\n    \"aria-hidden\": \"true\",\n    \"focusable\": \"false\",\n    \"height\": \"16\",\n    \"version\": \"1.1\",\n    \"viewBox\": \"0 0 16 16\",\n    \"width\": \"16\"\n  }), mdx(\"path\", _extends({\n    parentName: \"svg\"\n  }, {\n    \"fillRule\": \"evenodd\",\n    \"d\": \"M4 9h1v1H4c-1.5 0-3-1.69-3-3.5S2.55 3 4 3h4c1.45 0 3 1.69 3 3.5 0 1.41-.91 2.72-2 3.25V8.59c.58-.45 1-1.27 1-2.09C10 5.22 8.98 4 8 4H4c-.98 0-2 1.22-2 2.5S3 9 4 9zm9-3h-1v1h1c1 0 2 1.22 2 2.5S13.98 12 13 12H9c-.98 0-2-1.22-2-2.5 0-.83.42-1.64 1-2.09V6.25c-1.09.53-2 1.84-2 3.25C6 11.31 7.55 13 9 13h4c1.45 0 3-1.69 3-3.5S14.5 6 13 6z\"\n  })))), \"October\"), mdx(\"p\", null, \"It was another busy month for me! It started with a nice catch up with a friend while playing a couple rounds of pool. Then I attended and volunteered for the Aztec Mentor Program (AMP). There I met an ambitious student who has an interesting background with similar passions to mine. I decided to take him in as my mentee and I started working on my career and personal development online course.\"), mdx(Gallery, {\n    photos: [{\n      src: amp2,\n      width: 492,\n      height: 874\n    }],\n    mdxType: \"Gallery\"\n  }), mdx(\"p\", null, \"While I was at San Diego State University for the AMP event, my friend told me about an event going on in the ZIP Launchpad so I stopped by. There I got to see the new startups going through the program and I realized they needed help and I could help them. So I started talking with the director to set something up.\"), mdx(\"p\", null, \"I attended the Launch scale conference for startup founders. There I learned quite a bit about all sorts of things, you can find the recap \", mdx(\"a\", _extends({\n    parentName: \"p\"\n  }, {\n    \"href\": \"./launch-scale-2019-summary\"\n  }), \"here\"), \". The main highlight of the trip for me was getting dinner at \", mdx(\"a\", _extends({\n    parentName: \"p\"\n  }, {\n    \"href\": \"https://www.thebatterysf.com/\"\n  }), \"the battery\"), \" with an extremely talented and interesting CEO. I got to listen to Luke and the CEO go at it while I enjoyed the beyond burger for the first time.\"), mdx(\"p\", null, \"Soon after I got back from the conference, we learned that CourseKey is one of the \", mdx(\"a\", _extends({\n    parentName: \"p\"\n  }, {\n    \"href\": \"https://hired.com/san-diego\"\n  }), \"top tech employers in San Diego\"), \". I judged a ZIP Launchpad pitchfest competition for a business organization. We (Coursekey) ran our first virtual summit all in the same week. Which meant we deserved a nice happy hour celebration after work.\"), mdx(\"p\", null, \"Even though, I kept myself busy with all the things going on I still got to grow my professional network. I met up with a CTO of a very successful company in San Diego at the University Club atop symphony towers. The conversation was great, learned a lot, the food was great and the view was amazing!\"), mdx(\"p\", null, \"Through my increased involvement in the ZIP Launchpad, Luke and I met up with a team that has the potential to become a successful business. We provided them with advice and feedback, gave them lessons we learned and the mistakes we made in hopes that they take the knowledge we give them and apply it to create a successful business.\"), mdx(\"p\", null, \"Although it was a busy month that did not mean I did not get to enjoy it! I attended a beach birthday party where I somehow ended up in charge of barbecuing (for a bit). I spend more time with some friends walking on the beach at night. And to wrap up the month, I got to celebrate Halloween a couple of times. Once with the family in El Cajon where we enjoyed a spooky car show and events. Another, at work where I got to try delicious homemade spooky cupcakes and enjoy the elaborate customs of some coworkers. Finally had to say goodbye to Ming as he is traveling around before going back to Tokoyo to work for CourseKey full time.\"), mdx(Gallery, {\n    photos: [{\n      src: oct1,\n      width: 583,\n      height: 874\n    }, {\n      src: oct2,\n      width: 960,\n      height: 640\n    }, {\n      src: oct3,\n      width: 2016,\n      height: 1512\n    }, {\n      src: oct4,\n      width: 2016,\n      height: 1512\n    }, {\n      src: oct45,\n      width: 958,\n      height: 539\n    }, {\n      src: oct5,\n      width: 492,\n      height: 874\n    }, {\n      src: oct6,\n      width: 960,\n      height: 720\n    }],\n    mdxType: \"Gallery\"\n  }), mdx(\"h3\", {\n    \"id\": \"november\"\n  }, mdx(\"a\", _extends({\n    parentName: \"h3\"\n  }, {\n    \"href\": \"#november\",\n    \"aria-label\": \"november permalink\",\n    \"className\": \"anchor\"\n  }), mdx(\"svg\", _extends({\n    parentName: \"a\"\n  }, {\n    \"aria-hidden\": \"true\",\n    \"focusable\": \"false\",\n    \"height\": \"16\",\n    \"version\": \"1.1\",\n    \"viewBox\": \"0 0 16 16\",\n    \"width\": \"16\"\n  }), mdx(\"path\", _extends({\n    parentName: \"svg\"\n  }, {\n    \"fillRule\": \"evenodd\",\n    \"d\": \"M4 9h1v1H4c-1.5 0-3-1.69-3-3.5S2.55 3 4 3h4c1.45 0 3 1.69 3 3.5 0 1.41-.91 2.72-2 3.25V8.59c.58-.45 1-1.27 1-2.09C10 5.22 8.98 4 8 4H4c-.98 0-2 1.22-2 2.5S3 9 4 9zm9-3h-1v1h1c1 0 2 1.22 2 2.5S13.98 12 13 12H9c-.98 0-2-1.22-2-2.5 0-.83.42-1.64 1-2.09V6.25c-1.09.53-2 1.84-2 3.25C6 11.31 7.55 13 9 13h4c1.45 0 3-1.69 3-3.5S14.5 6 13 6z\"\n  })))), \"November\"), mdx(\"p\", null, \"I started the month by spending some time with friends from getting food and eating out to just meeting up at Starbucks and complaining about school/homework all over again. I met up with high school/college friends for coffee followed by Mr. Shawarma. The next day was Luke's and I Korean BBQ tradition. The following day was a shopping day with me and another friend at Fry's Electronics and wrapped up that week with a nice dinner with a close friend who I haven't seen in almost a year at Din Tai Fung. Later in the month my friends and I decided to get the all you can eat treatment at a Chinese buffet as well.\"), mdx(Gallery, {\n    photos: [{\n      src: din,\n      width: 1440,\n      height: 2560\n    }],\n    mdxType: \"Gallery\"\n  }), mdx(\"p\", null, \"This month has been extremely challenging with work! On average I had a minimum 14 hours days very regularly. Although with all that craziness I still managed to do quite a bit of things. I committed to being a \", mdx(\"a\", _extends({\n    parentName: \"p\"\n  }, {\n    \"href\": \"https://ziplaunchpad.sdsu.edu/resources\"\n  }), \"technical adviser for the startups at the ZIP Launchpad\"), \" (officially start in the spring semester).\"), mdx(\"p\", null, \"I still was able to network and attend different events. The first event was sitting down and chatting with the formal CEO of Udemy (one of our CourseKey advisers). Then I had a catch up with the VP of Engineering of Digital Media Solutions (DMS) formally Underground Elephant (UE).\"), mdx(\"p\", null, \"I also attended the friends giving event hosted by the graduate students association (GSA). I made new friends and got to help other friends to detect traffic lights for their autonomous car using a RaspberryPi.\"), mdx(YouTube, {\n    videoId: \"S4UHfE8tOzE\",\n    mdxType: \"YouTube\"\n  }), mdx(\"p\", null, \"Before the end of the month, I got invited to a meet up for the Chaldean Engineers. I got to learn about microwaves (frequencies, not the kitchen appliances), hang out with some friends, and make some new ones. It was great to talk to different engineers who are in different companies and industries.\"), mdx(\"p\", null, \"Additionally, I started the refinancing process for my house mortgage. After taking the deep dive into understanding money, the best use of my money is to invest it into growing assets. Currently, my house is not a growing asset. Instead, it is a liability and potentially a growing debt. To ensure I don't lose it and I don't lose a lot of money in the process of paying it off, I decided to do the refinancing.\"), mdx(\"p\", null, \"To wrap a crazy month, I had a blast during thanksgiving! We got to host the whole family in our place. We not only got to enjoy the company but also eat a lot of great food and play a bunch of games.\"), mdx(Gallery, {\n    photos: [{\n      src: turkey1,\n      width: 2016,\n      height: 1512\n    }, {\n      src: turkey2,\n      width: 960,\n      height: 482\n    }, {\n      src: turkey3,\n      width: 716,\n      height: 960\n    }, {\n      src: turkey4,\n      width: 2016,\n      height: 1512\n    }, {\n      src: turkey5,\n      width: 2016,\n      height: 1512\n    }, {\n      src: turkey6,\n      width: 716,\n      height: 960\n    }],\n    mdxType: \"Gallery\"\n  }), mdx(\"h3\", {\n    \"id\": \"december\"\n  }, mdx(\"a\", _extends({\n    parentName: \"h3\"\n  }, {\n    \"href\": \"#december\",\n    \"aria-label\": \"december permalink\",\n    \"className\": \"anchor\"\n  }), mdx(\"svg\", _extends({\n    parentName: \"a\"\n  }, {\n    \"aria-hidden\": \"true\",\n    \"focusable\": \"false\",\n    \"height\": \"16\",\n    \"version\": \"1.1\",\n    \"viewBox\": \"0 0 16 16\",\n    \"width\": \"16\"\n  }), mdx(\"path\", _extends({\n    parentName: \"svg\"\n  }, {\n    \"fillRule\": \"evenodd\",\n    \"d\": \"M4 9h1v1H4c-1.5 0-3-1.69-3-3.5S2.55 3 4 3h4c1.45 0 3 1.69 3 3.5 0 1.41-.91 2.72-2 3.25V8.59c.58-.45 1-1.27 1-2.09C10 5.22 8.98 4 8 4H4c-.98 0-2 1.22-2 2.5S3 9 4 9zm9-3h-1v1h1c1 0 2 1.22 2 2.5S13.98 12 13 12H9c-.98 0-2-1.22-2-2.5 0-.83.42-1.64 1-2.09V6.25c-1.09.53-2 1.84-2 3.25C6 11.31 7.55 13 9 13h4c1.45 0 3-1.69 3-3.5S14.5 6 13 6z\"\n  })))), \"December\"), mdx(\"p\", null, \"The craziness did not die down, on the contrary things got more intense. The deadline for the massive release grew closer and closer, while we are still working on it. Additionally, I had to plan for the end of the quarter as well as for next year.\"), mdx(\"p\", null, \"The refinancing process was still in progress. However, thanks to my family's help and my research, I was able to take advantage of a reduction of my mortgage from 30 years to only 15 years! Additionally, I lowered the interest rate from 3.99% to 2.5%. Although this process cost me quite a bit (my Japan trip fund \\uD83D\\uDE2D), it literally saved me hundreds of thousands. I \", mdx(\"a\", _extends({\n    parentName: \"p\"\n  }, {\n    \"href\": \"./the-mortgage-refinancing-process\"\n  }), \"documented\"), \" the whole process and the rationale behind it.\"), mdx(\"p\", null, \"Additionally, it is finals season which meant that I get to help people. I enjoy this because it allows to focus on different things and recharge a bit. As well as it helps me remember/relearn things that can be useful and interesting. And to top all of that my PC upgrade went terribly wrong, forcing me to reinstall windows which cost me a couple of days.\"), mdx(\"p\", null, \"Before people start taking time off for the holidays, we had our annual CourseKey holiday party. This year's party was also a combo event that included the celebration of our fundraising. We started with secret santa and white claws in the office. Then we did an escape room. Of course, I had to do the science room which is the most difficult room with a completion rate of 30%. We managed to solve all the puzzles and win with a couple of minutes to spare. Then we got to celebrate with a nice dinner and fun times with the whole team.\"), mdx(Gallery, {\n    photos: [{\n      src: chris1,\n      width: 703,\n      height: 937\n    }, {\n      src: chris2,\n      width: 500,\n      height: 888\n    }, {\n      src: chris3,\n      width: 888,\n      height: 888\n    }, {\n      src: chris4,\n      width: 1184,\n      height: 888\n    }],\n    mdxType: \"Gallery\"\n  }), mdx(\"p\", null, \"It was finally time to push the big update! We celebrated the release before even shipping it because I knew the team has done an amazing job. We enjoyed lunch at Fogo de Ch\\xE3o Brazilian Steakhouse then called it a day. At night, we took the application down and pushed the new one. There were couple hiccups that slowed us a bit but we still managed to have the app back online in half of the time we had planned for the outage. After that, it was time to take a break and relax a bit.\"), mdx(Gallery, {\n    photos: [{\n      src: wizardLunch,\n      width: 527,\n      height: 937\n    }],\n    mdxType: \"Gallery\"\n  }), mdx(\"p\", null, \"The first thing I did after was go hiking! I have been facing my computer screen for too long, I need to disconnect and go outside! The plan was to do the Cuyamaca Peak, but the trail was closed so we did the Stonewall Peak Trail. One hike was not enough! So the next day we did the Cowles Mountain!\"), mdx(Gallery, {\n    photos: [{\n      src: hike1,\n      width: 1579,\n      height: 888\n    }, {\n      src: hike2,\n      width: 1666,\n      height: 937\n    }, {\n      src: hike4,\n      width: 600,\n      height: 333\n    }, {\n      src: hike3,\n      width: 1666,\n      height: 937\n    }, {\n      src: hike5,\n      width: 1920,\n      height: 880\n    }],\n    mdxType: \"Gallery\"\n  }), mdx(\"p\", null, \"Christmas was fun, spent it with the family, ate a lot of food and got to relax. However, this time instead of working on another project, I decided to enjoy my time by playing a new game. I ended up playing a new Korean MMORPG (\", mdx(\"a\", _extends({\n    parentName: \"p\"\n  }, {\n    \"href\": \"https://store.steampowered.com/app/439350/KritikaREBOOT/\"\n  }), \"Kritika:REBOOT\"), \"), which brought back memories of me playing games for hours upon hours. I realized that my hand eye coordination has become worse than I expected. The good thing is after a couple hours of practice I improved considerably.\"), mdx(\"p\", null, \"After many years, I have finally learned traditional middle eastern dancing! I have learned \", mdx(\"a\", _extends({\n    parentName: \"p\"\n  }, {\n    \"href\": \"https://en.wikipedia.org/wiki/Assyrian_folk_dance\"\n  }), \"Khigga, Shekhani, and Gubbare\"), \". I am still not a beginner, but at least I can hold my own and not have people give up dancing next to me. This was in preparation for my cousin's engagement party, which was a blast!\"), mdx(Gallery, {\n    photos: [{\n      src: alvan1,\n      width: 2016,\n      height: 1512\n    }, {\n      src: alvan2,\n      width: 2016,\n      height: 1512\n    }, {\n      src: alvan3,\n      width: 2016,\n      height: 1512\n    }, {\n      src: alvan4,\n      width: 2016,\n      height: 1504\n    }, {\n      src: alvan5,\n      width: 2016,\n      height: 1504\n    }, {\n      src: alvan6,\n      width: 2016,\n      height: 1512\n    }, {\n      src: alvan7,\n      width: 716,\n      height: 960\n    }, {\n      src: alvan8,\n      width: 2016,\n      height: 1512\n    }],\n    mdxType: \"Gallery\"\n  }), mdx(YouTube, {\n    videoId: \"mTgOpiP-hZo\",\n    mdxType: \"YouTube\"\n  }), mdx(YouTube, {\n    videoId: \"_1RCoqs4zcs\",\n    mdxType: \"YouTube\"\n  }), mdx(YouTube, {\n    videoId: \"RthruIBJRC8\",\n    mdxType: \"YouTube\"\n  }), mdx(\"p\", null, \"The fun never ends! For new year's eve, I celebrated with the family.\"), mdx(Gallery, {\n    photos: [{\n      src: newyear1,\n      width: 2016,\n      height: 1512\n    }, {\n      src: newyear2,\n      width: 2016,\n      height: 1512\n    }, {\n      src: newyear3,\n      width: 2016,\n      height: 1512\n    }],\n    mdxType: \"Gallery\"\n  }), mdx(\"h2\", {\n    \"id\": \"summary\"\n  }, mdx(\"a\", _extends({\n    parentName: \"h2\"\n  }, {\n    \"href\": \"#summary\",\n    \"aria-label\": \"summary permalink\",\n    \"className\": \"anchor\"\n  }), mdx(\"svg\", _extends({\n    parentName: \"a\"\n  }, {\n    \"aria-hidden\": \"true\",\n    \"focusable\": \"false\",\n    \"height\": \"16\",\n    \"version\": \"1.1\",\n    \"viewBox\": \"0 0 16 16\",\n    \"width\": \"16\"\n  }), mdx(\"path\", _extends({\n    parentName: \"svg\"\n  }, {\n    \"fillRule\": \"evenodd\",\n    \"d\": \"M4 9h1v1H4c-1.5 0-3-1.69-3-3.5S2.55 3 4 3h4c1.45 0 3 1.69 3 3.5 0 1.41-.91 2.72-2 3.25V8.59c.58-.45 1-1.27 1-2.09C10 5.22 8.98 4 8 4H4c-.98 0-2 1.22-2 2.5S3 9 4 9zm9-3h-1v1h1c1 0 2 1.22 2 2.5S13.98 12 13 12H9c-.98 0-2-1.22-2-2.5 0-.83.42-1.64 1-2.09V6.25c-1.09.53-2 1.84-2 3.25C6 11.31 7.55 13 9 13h4c1.45 0 3-1.69 3-3.5S14.5 6 13 6z\"\n  })))), \"Summary\"), mdx(\"p\", null, \"This year has been both challenging and rewarding!\"), mdx(\"p\", null, \"At CourseKey we have built and shipped our biggest releases ever! We had two massive releases that changed how the system works entirely! The first big release was our groundwork that transitioned our system to an Accounting based attendance (record-keeping approach to attendance). The second massive release was the revamp of our adjustment/correction system where we created a wizard for the user to use along with a whole new set of features to solve major pain points they were experiencing.\"), mdx(\"p\", null, \"With all those challenges we experienced major growth. We got awarded our first patent. We were recognized as one of the 2019 Cool Companies by the San Diego Venture Group. Additionally, we were recognized as one of the top tech employers in San Diego by Hired. We have doubled our campus wide adoptions year over year in the last three years. We have raised $5 million series A. We did our first industry focused virtual summit. And most importantly, we have added new great people to the team.\"), mdx(\"p\", null, \"Balancing life, work, and learning! This has been one of the biggest issues that I have faced. The thing about balancing my time is that each section has so many different things that fall under it that figuring out the best approach to handling it all is not an easy feat. For example, in my life, there are so many things going on from family, friends, relationships, health, finances and so on. Work has me pulled into 100 different directions, from different projects, management, development, hiring, scaling, maintaining, security, mentoring and so on. Finally learning... the broadest problem! There is so much to learn that there is not enough time to absorb it all.\"), mdx(\"p\", null, \"I would love to say that I have figured out how to balance everything but the truth is, I still got no clue how to do that. The best thing that has helped me was defining a process for handling things and understanding the value of my time. First, having a process with everything going on. It is extremely easy for things to slip through especially when interacting with a lot of people. That is why I have evolved my workflow process to use the \\\"Getting things done\\\" methodology. I also have cleaned up my Trello board and reorganized it so it is no longer overwhelming. Second, understanding the value of my time. After reading Your Money or Your Life, I have a different perspective not just on money but also on life in general. The book made me reexamine how I spend my time which to me is the most valuable thing I have.\"), mdx(Gallery, {\n    photos: [{\n      src: GTD,\n      width: 531,\n      height: 882\n    }],\n    mdxType: \"Gallery\"\n  }), mdx(\"p\", null, \"Although things been crazy, I still got to enjoy the majority of my time. I got to travel with family and friends, try new food/places and build amazing technology. Throughout the spring, summer and fall almost every weekend I spent it out with either family or friends which meant when I got a weekend with no action it felt amazing! After taking a vacation with the family during the summer, I literally needed a vocation from the vocation because the exhaustion had caught up to me. Now, whenever I feel tired, I just dial things down a bit and take things a bit slower.\"), mdx(Gallery, {\n    photos: [{\n      src: other1,\n      width: 2048,\n      height: 1365\n    }, {\n      src: other2,\n      width: 2048,\n      height: 1365\n    }, {\n      src: other3,\n      width: 2048,\n      height: 1536\n    }, {\n      src: other4,\n      width: 2048,\n      height: 1365\n    }, {\n      src: other5,\n      width: 2016,\n      height: 980\n    }, {\n      src: other6,\n      width: 2016,\n      height: 1314\n    }, {\n      src: other7,\n      width: 2048,\n      height: 1365\n    }, {\n      src: other8,\n      width: 2016,\n      height: 980\n    }, {\n      src: other9,\n      width: 2016,\n      height: 980\n    }, {\n      src: other10,\n      width: 716,\n      height: 960\n    }, {\n      src: other11,\n      width: 2016,\n      height: 1512\n    }, {\n      src: other12,\n      width: 2016,\n      height: 1512\n    }, {\n      src: other13,\n      width: 2016,\n      height: 1512\n    }, {\n      src: other14,\n      width: 2016,\n      height: 1512\n    }, {\n      src: other15,\n      width: 716,\n      height: 960\n    }, {\n      src: other16,\n      width: 2016,\n      height: 1512\n    }, {\n      src: other17,\n      width: 2016,\n      height: 1512\n    }, {\n      src: other18,\n      width: 2016,\n      height: 1512\n    }, {\n      src: other19,\n      width: 2016,\n      height: 1512\n    }, {\n      src: other20,\n      width: 2048,\n      height: 1365\n    }, {\n      src: other21,\n      width: 2016,\n      height: 1512\n    }, {\n      src: other22,\n      width: 1920,\n      height: 1080\n    }, {\n      src: other23,\n      width: 2016,\n      height: 1512\n    }, {\n      src: other24,\n      width: 2016,\n      height: 1512\n    }, {\n      src: other25,\n      width: 958,\n      height: 539\n    }, {\n      src: other26,\n      width: 958,\n      height: 539\n    }, {\n      src: other27,\n      width: 650,\n      height: 867\n    }, {\n      src: other28,\n      width: 488,\n      height: 867\n    }, {\n      src: other29,\n      width: 958,\n      height: 720\n    }, {\n      src: other30,\n      width: 720,\n      height: 362\n    }, {\n      src: other31,\n      width: 2016,\n      height: 1512\n    }, {\n      src: other32,\n      width: 960,\n      height: 540\n    }, {\n      src: mesu,\n      width: 300,\n      height: 534\n    }, {\n      src: other33,\n      width: 1579,\n      height: 888\n    }, {\n      src: other34,\n      width: 500,\n      height: 888\n    }, {\n      src: other35,\n      width: 364,\n      height: 750\n    }, {\n      src: other36,\n      width: 1184,\n      height: 888\n    }, {\n      src: other37,\n      width: 2016,\n      height: 1134\n    }, {\n      src: other38,\n      width: 1184,\n      height: 888\n    }],\n    mdxType: \"Gallery\"\n  }), mdx(\"p\", null, \"Another major focus of this year for me was figuring out my financials. I did a heavy analysis of my assets and debts that I have accumulated over the last couple of years. Starting with assets, I analyzed the following:\"), mdx(\"ul\", null, mdx(\"li\", {\n    parentName: \"ul\"\n  }, \"Jewelry\"), mdx(\"li\", {\n    parentName: \"ul\"\n  }, \"Crypto assets\"), mdx(\"li\", {\n    parentName: \"ul\"\n  }, \"Robinhood shares\"), mdx(\"li\", {\n    parentName: \"ul\"\n  }, \"My retirement account\"), mdx(\"li\", {\n    parentName: \"ul\"\n  }, \"My health savings account\"), mdx(\"li\", {\n    parentName: \"ul\"\n  }, \"Car\"), mdx(\"li\", {\n    parentName: \"ul\"\n  }, \"Real estate\"), mdx(\"li\", {\n    parentName: \"ul\"\n  }, \"Cash \")), mdx(\"p\", null, \"As for debts, I only have the house mortgage and my car loan. Looking at both my debts and assets, I managed to increase my net worth more than I expected was possible. Starting with the debts, I refinanced my mortgage for a \", mdx(\"a\", _extends({\n    parentName: \"p\"\n  }, {\n    \"href\": \"./the-mortgage-refinancing-process\"\n  }), \"better deal\"), \", saving me hundreds of thousands. For my assets, I improved my cash savings returns by using a \", mdx(\"a\", _extends({\n    parentName: \"p\"\n  }, {\n    \"href\": \"https://www.doctorofcredit.com/high-interest-savings-to-get/\"\n  }), \"better bank\"), \". I also reallocated my health savings account and retirement account fonds, so I am not being charged a ridiculous amount of fees. That increased the value of my existing assets and as I am paying off my debts my net worth kept on growing.\"), mdx(\"p\", null, \"I did not stop there, I did a lot of reading focused on managing money (see \", mdx(\"a\", _extends({\n    parentName: \"p\"\n  }, {\n    \"href\": \"#reading-materials-this-year\"\n  }), \"reading materials section\"), \") and thanks to that I have a better understanding of my money. I managed to find out my expected vs actual income for the last five years and see the growth. I have also set up a system to monitor my net worth and its growth over time.\"), mdx(Gallery, {\n    photos: [{\n      src: fin1,\n      width: 604,\n      height: 376\n    }, {\n      src: fin2,\n      width: 607,\n      height: 375\n    }, {\n      src: fin3,\n      width: 607,\n      height: 373\n    }, {\n      src: fin4,\n      width: 608,\n      height: 380\n    }, {\n      src: fin5,\n      width: 714,\n      height: 422\n    }],\n    mdxType: \"Gallery\"\n  }), mdx(\"h3\", {\n    \"id\": \"goals-achieved-this-year\"\n  }, mdx(\"a\", _extends({\n    parentName: \"h3\"\n  }, {\n    \"href\": \"#goals-achieved-this-year\",\n    \"aria-label\": \"goals achieved this year permalink\",\n    \"className\": \"anchor\"\n  }), mdx(\"svg\", _extends({\n    parentName: \"a\"\n  }, {\n    \"aria-hidden\": \"true\",\n    \"focusable\": \"false\",\n    \"height\": \"16\",\n    \"version\": \"1.1\",\n    \"viewBox\": \"0 0 16 16\",\n    \"width\": \"16\"\n  }), mdx(\"path\", _extends({\n    parentName: \"svg\"\n  }, {\n    \"fillRule\": \"evenodd\",\n    \"d\": \"M4 9h1v1H4c-1.5 0-3-1.69-3-3.5S2.55 3 4 3h4c1.45 0 3 1.69 3 3.5 0 1.41-.91 2.72-2 3.25V8.59c.58-.45 1-1.27 1-2.09C10 5.22 8.98 4 8 4H4c-.98 0-2 1.22-2 2.5S3 9 4 9zm9-3h-1v1h1c1 0 2 1.22 2 2.5S13.98 12 13 12H9c-.98 0-2-1.22-2-2.5 0-.83.42-1.64 1-2.09V6.25c-1.09.53-2 1.84-2 3.25C6 11.31 7.55 13 9 13h4c1.45 0 3-1.69 3-3.5S14.5 6 13 6z\"\n  })))), \"Goals achieved this year\"), mdx(\"h4\", {\n    \"id\": \"major-life-goals\"\n  }, mdx(\"a\", _extends({\n    parentName: \"h4\"\n  }, {\n    \"href\": \"#major-life-goals\",\n    \"aria-label\": \"major life goals permalink\",\n    \"className\": \"anchor\"\n  }), mdx(\"svg\", _extends({\n    parentName: \"a\"\n  }, {\n    \"aria-hidden\": \"true\",\n    \"focusable\": \"false\",\n    \"height\": \"16\",\n    \"version\": \"1.1\",\n    \"viewBox\": \"0 0 16 16\",\n    \"width\": \"16\"\n  }), mdx(\"path\", _extends({\n    parentName: \"svg\"\n  }, {\n    \"fillRule\": \"evenodd\",\n    \"d\": \"M4 9h1v1H4c-1.5 0-3-1.69-3-3.5S2.55 3 4 3h4c1.45 0 3 1.69 3 3.5 0 1.41-.91 2.72-2 3.25V8.59c.58-.45 1-1.27 1-2.09C10 5.22 8.98 4 8 4H4c-.98 0-2 1.22-2 2.5S3 9 4 9zm9-3h-1v1h1c1 0 2 1.22 2 2.5S13.98 12 13 12H9c-.98 0-2-1.22-2-2.5 0-.83.42-1.64 1-2.09V6.25c-1.09.53-2 1.84-2 3.25C6 11.31 7.55 13 9 13h4c1.45 0 3-1.69 3-3.5S14.5 6 13 6z\"\n  })))), \"Major Life goals\"), mdx(\"ul\", null, mdx(\"li\", {\n    parentName: \"ul\"\n  }, mdx(\"strong\", {\n    parentName: \"li\"\n  }, \"Become an engineer\"), \": This has been one of my goals since I was in the third grade! Over time it got more specific and decided to become a computer engineer. Although, I was working professionally as an engineer I wanted to make it official. I don't quit and I don't run! So for the last year and a half, I buckled up and finally became a computer engineer.\", mdx(Gallery, {\n    photos: [{\n      src: ce1,\n      width: 705,\n      height: 874\n    }, {\n      src: ce2,\n      width: 958,\n      height: 539\n    }],\n    mdxType: \"Gallery\"\n  })), mdx(\"li\", {\n    parentName: \"ul\"\n  }, mdx(\"strong\", {\n    parentName: \"li\"\n  }, \"Earn a patent\"), \": Another dream of mine was to be known as an inventor. With all the amazing solutions we are building/inventing at CourseKey, we can claim many inventions. The only restricting part is the amount of legal work and the financial cost. As of right now, we have a \", mdx(\"a\", _extends({\n    parentName: \"li\"\n  }, {\n    \"href\": \"https://patents.google.com/?inventor=Fadee+Kannah\"\n  }), \"patent awarded and another\"), \" that is currently pending.\"), mdx(\"li\", {\n    parentName: \"ul\"\n  }, mdx(\"strong\", {\n    parentName: \"li\"\n  }, \"Become a mentor\"), \": I enjoy helping and guiding others. This year I took on my first mentee who just started at SDSU. I also helped a couple of startups from the ZIP launchpad. I will be an \", mdx(\"a\", _extends({\n    parentName: \"li\"\n  }, {\n    \"href\": \"https://ziplaunchpad.sdsu.edu/resources\"\n  }), \"official mentor/adviser\"), \" for the tech startups in the program starting in the new year.\")), mdx(\"h4\", {\n    \"id\": \"yearly-goals\"\n  }, mdx(\"a\", _extends({\n    parentName: \"h4\"\n  }, {\n    \"href\": \"#yearly-goals\",\n    \"aria-label\": \"yearly goals permalink\",\n    \"className\": \"anchor\"\n  }), mdx(\"svg\", _extends({\n    parentName: \"a\"\n  }, {\n    \"aria-hidden\": \"true\",\n    \"focusable\": \"false\",\n    \"height\": \"16\",\n    \"version\": \"1.1\",\n    \"viewBox\": \"0 0 16 16\",\n    \"width\": \"16\"\n  }), mdx(\"path\", _extends({\n    parentName: \"svg\"\n  }, {\n    \"fillRule\": \"evenodd\",\n    \"d\": \"M4 9h1v1H4c-1.5 0-3-1.69-3-3.5S2.55 3 4 3h4c1.45 0 3 1.69 3 3.5 0 1.41-.91 2.72-2 3.25V8.59c.58-.45 1-1.27 1-2.09C10 5.22 8.98 4 8 4H4c-.98 0-2 1.22-2 2.5S3 9 4 9zm9-3h-1v1h1c1 0 2 1.22 2 2.5S13.98 12 13 12H9c-.98 0-2-1.22-2-2.5 0-.83.42-1.64 1-2.09V6.25c-1.09.53-2 1.84-2 3.25C6 11.31 7.55 13 9 13h4c1.45 0 3-1.69 3-3.5S14.5 6 13 6z\"\n  })))), \"Yearly Goals\"), mdx(\"ul\", null, mdx(\"li\", {\n    parentName: \"ul\"\n  }, \"Have a better understanding of my financial situation\", mdx(\"ul\", {\n    parentName: \"li\"\n  }, mdx(\"li\", {\n    parentName: \"ul\"\n  }, \"Create budgets and monitor spending\"), mdx(\"li\", {\n    parentName: \"ul\"\n  }, \"Educate myself on money, spending, investing and so on...\"), mdx(\"li\", {\n    parentName: \"ul\"\n  }, \"Evaluate and track net worth\"))), mdx(\"li\", {\n    parentName: \"ul\"\n  }, \"Grow professionally\", mdx(\"ul\", {\n    parentName: \"li\"\n  }, mdx(\"li\", {\n    parentName: \"ul\"\n  }, \"Grow my technical network (connect with two senior level people)\"), mdx(\"li\", {\n    parentName: \"ul\"\n  }, \"Grow my executive network (connect with two executive level people)\"), mdx(\"li\", {\n    parentName: \"ul\"\n  }, \"Become a better CTO\", mdx(\"ul\", {\n    parentName: \"li\"\n  }, mdx(\"li\", {\n    parentName: \"ul\"\n  }, \"Continue to learn and develop my technical skills\"), mdx(\"li\", {\n    parentName: \"ul\"\n  }, \"Keep up with the technical podcasts\"), mdx(\"li\", {\n    parentName: \"ul\"\n  }, \"Educate myself\"))))), mdx(\"li\", {\n    parentName: \"ul\"\n  }, \"Work on \", mdx(\"a\", _extends({\n    parentName: \"li\"\n  }, {\n    \"href\": \"#Personal-Side-Projects\"\n  }), \"side projects\")), mdx(\"li\", {\n    parentName: \"ul\"\n  }, \"Improve my communication skills\", mdx(\"ul\", {\n    parentName: \"li\"\n  }, mdx(\"li\", {\n    parentName: \"ul\"\n  }, \"Become better at confrontations\"), mdx(\"li\", {\n    parentName: \"ul\"\n  }, \"Communicate my thoughts better\"), mdx(\"li\", {\n    parentName: \"ul\"\n  }, \"Eliminate misunderstandings\")))), mdx(\"h3\", {\n    \"id\": \"personal-side-projects\"\n  }, mdx(\"a\", _extends({\n    parentName: \"h3\"\n  }, {\n    \"href\": \"#personal-side-projects\",\n    \"aria-label\": \"personal side projects permalink\",\n    \"className\": \"anchor\"\n  }), mdx(\"svg\", _extends({\n    parentName: \"a\"\n  }, {\n    \"aria-hidden\": \"true\",\n    \"focusable\": \"false\",\n    \"height\": \"16\",\n    \"version\": \"1.1\",\n    \"viewBox\": \"0 0 16 16\",\n    \"width\": \"16\"\n  }), mdx(\"path\", _extends({\n    parentName: \"svg\"\n  }, {\n    \"fillRule\": \"evenodd\",\n    \"d\": \"M4 9h1v1H4c-1.5 0-3-1.69-3-3.5S2.55 3 4 3h4c1.45 0 3 1.69 3 3.5 0 1.41-.91 2.72-2 3.25V8.59c.58-.45 1-1.27 1-2.09C10 5.22 8.98 4 8 4H4c-.98 0-2 1.22-2 2.5S3 9 4 9zm9-3h-1v1h1c1 0 2 1.22 2 2.5S13.98 12 13 12H9c-.98 0-2-1.22-2-2.5 0-.83.42-1.64 1-2.09V6.25c-1.09.53-2 1.84-2 3.25C6 11.31 7.55 13 9 13h4c1.45 0 3-1.69 3-3.5S14.5 6 13 6z\"\n  })))), \"Personal Side Projects\"), mdx(\"h4\", {\n    \"id\": \"automation-testing-and-releasing-of-my-open-source-packages\"\n  }, mdx(\"a\", _extends({\n    parentName: \"h4\"\n  }, {\n    \"href\": \"#automation-testing-and-releasing-of-my-open-source-packages\",\n    \"aria-label\": \"automation testing and releasing of my open source packages permalink\",\n    \"className\": \"anchor\"\n  }), mdx(\"svg\", _extends({\n    parentName: \"a\"\n  }, {\n    \"aria-hidden\": \"true\",\n    \"focusable\": \"false\",\n    \"height\": \"16\",\n    \"version\": \"1.1\",\n    \"viewBox\": \"0 0 16 16\",\n    \"width\": \"16\"\n  }), mdx(\"path\", _extends({\n    parentName: \"svg\"\n  }, {\n    \"fillRule\": \"evenodd\",\n    \"d\": \"M4 9h1v1H4c-1.5 0-3-1.69-3-3.5S2.55 3 4 3h4c1.45 0 3 1.69 3 3.5 0 1.41-.91 2.72-2 3.25V8.59c.58-.45 1-1.27 1-2.09C10 5.22 8.98 4 8 4H4c-.98 0-2 1.22-2 2.5S3 9 4 9zm9-3h-1v1h1c1 0 2 1.22 2 2.5S13.98 12 13 12H9c-.98 0-2-1.22-2-2.5 0-.83.42-1.64 1-2.09V6.25c-1.09.53-2 1.84-2 3.25C6 11.31 7.55 13 9 13h4c1.45 0 3-1.69 3-3.5S14.5 6 13 6z\"\n  })))), \"Automation testing and releasing of my open source packages\"), mdx(\"p\", null, \"All my \\\"maintained\\\" packages now have an automated continuous integration and deployment built using Github actions including updating. Whenever a dependency changes, I press one button and the process automatically updates, tests, bundles and releases it.\"), mdx(Gallery, {\n    photos: [{\n      src: gh,\n      width: 1682,\n      height: 351\n    }],\n    mdxType: \"Gallery\"\n  }), mdx(\"h4\", {\n    \"id\": \"create-a-blog-using-gatsby\"\n  }, mdx(\"a\", _extends({\n    parentName: \"h4\"\n  }, {\n    \"href\": \"#create-a-blog-using-gatsby\",\n    \"aria-label\": \"create a blog using gatsby permalink\",\n    \"className\": \"anchor\"\n  }), mdx(\"svg\", _extends({\n    parentName: \"a\"\n  }, {\n    \"aria-hidden\": \"true\",\n    \"focusable\": \"false\",\n    \"height\": \"16\",\n    \"version\": \"1.1\",\n    \"viewBox\": \"0 0 16 16\",\n    \"width\": \"16\"\n  }), mdx(\"path\", _extends({\n    parentName: \"svg\"\n  }, {\n    \"fillRule\": \"evenodd\",\n    \"d\": \"M4 9h1v1H4c-1.5 0-3-1.69-3-3.5S2.55 3 4 3h4c1.45 0 3 1.69 3 3.5 0 1.41-.91 2.72-2 3.25V8.59c.58-.45 1-1.27 1-2.09C10 5.22 8.98 4 8 4H4c-.98 0-2 1.22-2 2.5S3 9 4 9zm9-3h-1v1h1c1 0 2 1.22 2 2.5S13.98 12 13 12H9c-.98 0-2-1.22-2-2.5 0-.83.42-1.64 1-2.09V6.25c-1.09.53-2 1.84-2 3.25C6 11.31 7.55 13 9 13h4c1.45 0 3-1.69 3-3.5S14.5 6 13 6z\"\n  })))), \"Create a blog using gatsby\"), mdx(\"p\", null, \"After using medium for a while, I disliked it because it could not handle complex long posts. Additionally, with all the new paywalls they are adding I decided I could do it better so this is why I created \", mdx(\"a\", _extends({\n    parentName: \"p\"\n  }, {\n    \"href\": \"./\"\n  }), \"my blog\"), \".\"), mdx(\"h4\", {\n    \"id\": \"contacts-management-system\"\n  }, mdx(\"a\", _extends({\n    parentName: \"h4\"\n  }, {\n    \"href\": \"#contacts-management-system\",\n    \"aria-label\": \"contacts management system permalink\",\n    \"className\": \"anchor\"\n  }), mdx(\"svg\", _extends({\n    parentName: \"a\"\n  }, {\n    \"aria-hidden\": \"true\",\n    \"focusable\": \"false\",\n    \"height\": \"16\",\n    \"version\": \"1.1\",\n    \"viewBox\": \"0 0 16 16\",\n    \"width\": \"16\"\n  }), mdx(\"path\", _extends({\n    parentName: \"svg\"\n  }, {\n    \"fillRule\": \"evenodd\",\n    \"d\": \"M4 9h1v1H4c-1.5 0-3-1.69-3-3.5S2.55 3 4 3h4c1.45 0 3 1.69 3 3.5 0 1.41-.91 2.72-2 3.25V8.59c.58-.45 1-1.27 1-2.09C10 5.22 8.98 4 8 4H4c-.98 0-2 1.22-2 2.5S3 9 4 9zm9-3h-1v1h1c1 0 2 1.22 2 2.5S13.98 12 13 12H9c-.98 0-2-1.22-2-2.5 0-.83.42-1.64 1-2.09V6.25c-1.09.53-2 1.84-2 3.25C6 11.31 7.55 13 9 13h4c1.45 0 3-1.69 3-3.5S14.5 6 13 6z\"\n  })))), \"Contacts management system\"), mdx(\"p\", null, \"I used pipedrive, hubspot, airtable then decided to build my own which I postponed for now\"), mdx(\"h4\", {\n    \"id\": \"image-processing-and-face-detection\"\n  }, mdx(\"a\", _extends({\n    parentName: \"h4\"\n  }, {\n    \"href\": \"#image-processing-and-face-detection\",\n    \"aria-label\": \"image processing and face detection permalink\",\n    \"className\": \"anchor\"\n  }), mdx(\"svg\", _extends({\n    parentName: \"a\"\n  }, {\n    \"aria-hidden\": \"true\",\n    \"focusable\": \"false\",\n    \"height\": \"16\",\n    \"version\": \"1.1\",\n    \"viewBox\": \"0 0 16 16\",\n    \"width\": \"16\"\n  }), mdx(\"path\", _extends({\n    parentName: \"svg\"\n  }, {\n    \"fillRule\": \"evenodd\",\n    \"d\": \"M4 9h1v1H4c-1.5 0-3-1.69-3-3.5S2.55 3 4 3h4c1.45 0 3 1.69 3 3.5 0 1.41-.91 2.72-2 3.25V8.59c.58-.45 1-1.27 1-2.09C10 5.22 8.98 4 8 4H4c-.98 0-2 1.22-2 2.5S3 9 4 9zm9-3h-1v1h1c1 0 2 1.22 2 2.5S13.98 12 13 12H9c-.98 0-2-1.22-2-2.5 0-.83.42-1.64 1-2.09V6.25c-1.09.53-2 1.84-2 3.25C6 11.31 7.55 13 9 13h4c1.45 0 3-1.69 3-3.5S14.5 6 13 6z\"\n  })))), \"Image processing and face detection\"), mdx(\"p\", null, \"When helping my friends with their autonomous car, I got to play a little bit with image processing. That peaked my curiosity and I decided to play a little bit more with it. I just played around with this \", mdx(\"a\", _extends({\n    parentName: \"p\"\n  }, {\n    \"href\": \"https://pythonprogramming.net/haar-cascade-face-eye-detection-python-opencv-tutorial/?fbclid=IwAR0J-C5WPlYlpni1LgKfT85EUQsGWWjI9ZTp285jM9lbDO_pXiPpzkbpsMA\"\n  }), \"nice tutorial\"), \" to detect my face. For those interested, there are already prebuilt cascades (detections models) available \", mdx(\"a\", _extends({\n    parentName: \"p\"\n  }, {\n    \"href\": \"https://github.com/opencv/opencv/tree/master/data/haarcascades\"\n  }), \"online\"), \".\"), mdx(Gallery, {\n    photos: [{\n      src: facedetect,\n      width: 1251,\n      height: 513\n    }],\n    mdxType: \"Gallery\"\n  }), mdx(\"h4\", {\n    \"id\": \"setup-automated-smart-backup-using-azure\"\n  }, mdx(\"a\", _extends({\n    parentName: \"h4\"\n  }, {\n    \"href\": \"#setup-automated-smart-backup-using-azure\",\n    \"aria-label\": \"setup automated smart backup using azure permalink\",\n    \"className\": \"anchor\"\n  }), mdx(\"svg\", _extends({\n    parentName: \"a\"\n  }, {\n    \"aria-hidden\": \"true\",\n    \"focusable\": \"false\",\n    \"height\": \"16\",\n    \"version\": \"1.1\",\n    \"viewBox\": \"0 0 16 16\",\n    \"width\": \"16\"\n  }), mdx(\"path\", _extends({\n    parentName: \"svg\"\n  }, {\n    \"fillRule\": \"evenodd\",\n    \"d\": \"M4 9h1v1H4c-1.5 0-3-1.69-3-3.5S2.55 3 4 3h4c1.45 0 3 1.69 3 3.5 0 1.41-.91 2.72-2 3.25V8.59c.58-.45 1-1.27 1-2.09C10 5.22 8.98 4 8 4H4c-.98 0-2 1.22-2 2.5S3 9 4 9zm9-3h-1v1h1c1 0 2 1.22 2 2.5S13.98 12 13 12H9c-.98 0-2-1.22-2-2.5 0-.83.42-1.64 1-2.09V6.25c-1.09.53-2 1.84-2 3.25C6 11.31 7.55 13 9 13h4c1.45 0 3-1.69 3-3.5S14.5 6 13 6z\"\n  })))), \"Setup automated smart backup using Azure\"), mdx(\"p\", null, \"Having a backup drive at home is good but not good enough for me. There is a lot of risk with having the backup in once place. So to protect it, I set up and automated system that encrypts and backs up all my data not only to the backup drive but also to the cloud.\"), mdx(Gallery, {\n    photos: [{\n      src: backup,\n      width: 571,\n      height: 837\n    }],\n    mdxType: \"Gallery\"\n  }), mdx(\"h4\", {\n    \"id\": \"create-personal-and-career-development-course-wip\"\n  }, mdx(\"a\", _extends({\n    parentName: \"h4\"\n  }, {\n    \"href\": \"#create-personal-and-career-development-course-wip\",\n    \"aria-label\": \"create personal and career development course wip permalink\",\n    \"className\": \"anchor\"\n  }), mdx(\"svg\", _extends({\n    parentName: \"a\"\n  }, {\n    \"aria-hidden\": \"true\",\n    \"focusable\": \"false\",\n    \"height\": \"16\",\n    \"version\": \"1.1\",\n    \"viewBox\": \"0 0 16 16\",\n    \"width\": \"16\"\n  }), mdx(\"path\", _extends({\n    parentName: \"svg\"\n  }, {\n    \"fillRule\": \"evenodd\",\n    \"d\": \"M4 9h1v1H4c-1.5 0-3-1.69-3-3.5S2.55 3 4 3h4c1.45 0 3 1.69 3 3.5 0 1.41-.91 2.72-2 3.25V8.59c.58-.45 1-1.27 1-2.09C10 5.22 8.98 4 8 4H4c-.98 0-2 1.22-2 2.5S3 9 4 9zm9-3h-1v1h1c1 0 2 1.22 2 2.5S13.98 12 13 12H9c-.98 0-2-1.22-2-2.5 0-.83.42-1.64 1-2.09V6.25c-1.09.53-2 1.84-2 3.25C6 11.31 7.55 13 9 13h4c1.45 0 3-1.69 3-3.5S14.5 6 13 6z\"\n  })))), \"Create personal and career development course (WIP)\"), mdx(\"p\", null, \"This is something I wanted to do since I was in college. I often run into exceptional people that lack a direction or don't know what they should be doing. Because of that, I got into mentoring. However, mentoring is limited and is not scalable. This is why I started putting together a course to share my knowledge and information with as many people as possible.\"), mdx(\"h4\", {\n    \"id\": \"setup-automated-smart-media-center-using-docker\"\n  }, mdx(\"a\", _extends({\n    parentName: \"h4\"\n  }, {\n    \"href\": \"#setup-automated-smart-media-center-using-docker\",\n    \"aria-label\": \"setup automated smart media center using docker permalink\",\n    \"className\": \"anchor\"\n  }), mdx(\"svg\", _extends({\n    parentName: \"a\"\n  }, {\n    \"aria-hidden\": \"true\",\n    \"focusable\": \"false\",\n    \"height\": \"16\",\n    \"version\": \"1.1\",\n    \"viewBox\": \"0 0 16 16\",\n    \"width\": \"16\"\n  }), mdx(\"path\", _extends({\n    parentName: \"svg\"\n  }, {\n    \"fillRule\": \"evenodd\",\n    \"d\": \"M4 9h1v1H4c-1.5 0-3-1.69-3-3.5S2.55 3 4 3h4c1.45 0 3 1.69 3 3.5 0 1.41-.91 2.72-2 3.25V8.59c.58-.45 1-1.27 1-2.09C10 5.22 8.98 4 8 4H4c-.98 0-2 1.22-2 2.5S3 9 4 9zm9-3h-1v1h1c1 0 2 1.22 2 2.5S13.98 12 13 12H9c-.98 0-2-1.22-2-2.5 0-.83.42-1.64 1-2.09V6.25c-1.09.53-2 1.84-2 3.25C6 11.31 7.55 13 9 13h4c1.45 0 3-1.69 3-3.5S14.5 6 13 6z\"\n  })))), \"Setup automated smart media center using docker\"), mdx(\"p\", null, \"I wanted to play around with multi-services architecture and learn how far I can push it on my computer. Apparently pretty far... The system is set up to track any movie or tv show. When it becomes available it automatically searches the internet and downloads it in the quality I set it to. Once downloaded, it automatically finds both English and Arabic subtitles and it updates the media server. The media server makes it all available for streaming on any smart device in my network.\"), mdx(Gallery, {\n    photos: [{\n      src: media,\n      width: 698,\n      height: 686\n    }],\n    mdxType: \"Gallery\"\n  }), mdx(\"h3\", {\n    \"id\": \"reading-materials-this-year\"\n  }, mdx(\"a\", _extends({\n    parentName: \"h3\"\n  }, {\n    \"href\": \"#reading-materials-this-year\",\n    \"aria-label\": \"reading materials this year permalink\",\n    \"className\": \"anchor\"\n  }), mdx(\"svg\", _extends({\n    parentName: \"a\"\n  }, {\n    \"aria-hidden\": \"true\",\n    \"focusable\": \"false\",\n    \"height\": \"16\",\n    \"version\": \"1.1\",\n    \"viewBox\": \"0 0 16 16\",\n    \"width\": \"16\"\n  }), mdx(\"path\", _extends({\n    parentName: \"svg\"\n  }, {\n    \"fillRule\": \"evenodd\",\n    \"d\": \"M4 9h1v1H4c-1.5 0-3-1.69-3-3.5S2.55 3 4 3h4c1.45 0 3 1.69 3 3.5 0 1.41-.91 2.72-2 3.25V8.59c.58-.45 1-1.27 1-2.09C10 5.22 8.98 4 8 4H4c-.98 0-2 1.22-2 2.5S3 9 4 9zm9-3h-1v1h1c1 0 2 1.22 2 2.5S13.98 12 13 12H9c-.98 0-2-1.22-2-2.5 0-.83.42-1.64 1-2.09V6.25c-1.09.53-2 1.84-2 3.25C6 11.31 7.55 13 9 13h4c1.45 0 3-1.69 3-3.5S14.5 6 13 6z\"\n  })))), \"Reading Materials this year\"), mdx(\"ul\", null, mdx(\"li\", {\n    parentName: \"ul\"\n  }, mdx(\"a\", _extends({\n    parentName: \"li\"\n  }, {\n    \"href\": \"https://www.amazon.com/dp/B00SNTLHWA/ref=dp-kindle-redirect?_encoding=UTF8&btkr=1\"\n  }), \"F.U. Money\"), \" \", mdx(\"a\", _extends({\n    parentName: \"li\"\n  }, {\n    \"href\": \"./f-u-money\"\n  }), \"\\uD83D\\uDCD3 My summary\")), mdx(\"li\", {\n    parentName: \"ul\"\n  }, \"Re-read \", mdx(\"a\", _extends({\n    parentName: \"li\"\n  }, {\n    \"href\": \"https://www.amazon.com/Zero-One-Notes-Startups-Future-ebook/dp/B00J6YBOFQ\"\n  }), \"Zero to One\"), \" \", mdx(\"a\", _extends({\n    parentName: \"li\"\n  }, {\n    \"href\": \"./zero-to-one\"\n  }), \"\\uD83D\\uDCD3 My summary\")), mdx(\"li\", {\n    parentName: \"ul\"\n  }, \"Fun reads\", mdx(\"ul\", {\n    parentName: \"li\"\n  }, mdx(\"li\", {\n    parentName: \"ul\"\n  }, mdx(\"a\", _extends({\n    parentName: \"li\"\n  }, {\n    \"href\": \"https://www.amazon.com/100-Tricks-Appear-Smart-Meetings-ebook/dp/B01H1386CW/ref=sr_1_1\"\n  }), \"100 Tricks to appear smart in meetings\"), \" \", mdx(\"a\", _extends({\n    parentName: \"li\"\n  }, {\n    \"href\": \"./100-tricks-to-appear-smart-in-meetings\"\n  }), \"\\uD83D\\uDCD3 My summary\")), mdx(\"li\", {\n    parentName: \"ul\"\n  }, mdx(\"a\", _extends({\n    parentName: \"li\"\n  }, {\n    \"href\": \"https://www.amazon.com/Uncle-Johns-Presents-Necessary-Numbers/dp/1571458662\"\n  }), \"Necessary Numbers\")), mdx(\"li\", {\n    parentName: \"ul\"\n  }, mdx(\"a\", _extends({\n    parentName: \"li\"\n  }, {\n    \"href\": \"https://www.amazon.com/Ecommerce-Millionaires-Underground-Playbook-Eight-Figure/dp/0578402920\"\n  }), \"Ecommerce Millionaires\")))), mdx(\"li\", {\n    parentName: \"ul\"\n  }, \"My deep dive reading sources to understand my finances\", mdx(\"ul\", {\n    parentName: \"li\"\n  }, mdx(\"li\", {\n    parentName: \"ul\"\n  }, mdx(\"a\", _extends({\n    parentName: \"li\"\n  }, {\n    \"href\": \"https://www.amazon.com/Your-Money-Life-Transforming-Relationship-ebook/dp/B0052MD8VO/\"\n  }), \"Your Money or Your Life\"), \" \", mdx(\"a\", _extends({\n    parentName: \"li\"\n  }, {\n    \"href\": \"./your-money-or-your-life\"\n  }), \"\\uD83D\\uDCD3 My summary\")), mdx(\"li\", {\n    parentName: \"ul\"\n  }, mdx(\"a\", _extends({\n    parentName: \"li\"\n  }, {\n    \"href\": \"https://old.reddit.com/r/personalfinance\"\n  }), \"Personal Finance\"), \" \", mdx(\"a\", _extends({\n    parentName: \"li\"\n  }, {\n    \"href\": \"https://old.reddit.com/r/personalfinance/wiki/index\"\n  }), \"\\uD83D\\uDCD3 Summary\")), mdx(\"li\", {\n    parentName: \"ul\"\n  }, mdx(\"a\", _extends({\n    parentName: \"li\"\n  }, {\n    \"href\": \"https://old.reddit.com/r/financialindependence/wiki/index\"\n  }), \"Financial Independence\")), mdx(\"li\", {\n    parentName: \"ul\"\n  }, mdx(\"a\", _extends({\n    parentName: \"li\"\n  }, {\n    \"href\": \"http://earlyretirementextreme.com\"\n  }), \"Early Retirement Extreme\")), mdx(\"li\", {\n    parentName: \"ul\"\n  }, mdx(\"a\", _extends({\n    parentName: \"li\"\n  }, {\n    \"href\": \"https://www.bogleheads.org/wiki/Getting_started\"\n  }), \"Bogleheads\")), mdx(\"li\", {\n    parentName: \"ul\"\n  }, mdx(\"a\", _extends({\n    parentName: \"li\"\n  }, {\n    \"href\": \"https://www.gocurrycracker.com/start-here/\"\n  }), \"Go Curry Cracker\"))))), mdx(\"h3\", {\n    \"id\": \"podcasts\"\n  }, mdx(\"a\", _extends({\n    parentName: \"h3\"\n  }, {\n    \"href\": \"#podcasts\",\n    \"aria-label\": \"podcasts permalink\",\n    \"className\": \"anchor\"\n  }), mdx(\"svg\", _extends({\n    parentName: \"a\"\n  }, {\n    \"aria-hidden\": \"true\",\n    \"focusable\": \"false\",\n    \"height\": \"16\",\n    \"version\": \"1.1\",\n    \"viewBox\": \"0 0 16 16\",\n    \"width\": \"16\"\n  }), mdx(\"path\", _extends({\n    parentName: \"svg\"\n  }, {\n    \"fillRule\": \"evenodd\",\n    \"d\": \"M4 9h1v1H4c-1.5 0-3-1.69-3-3.5S2.55 3 4 3h4c1.45 0 3 1.69 3 3.5 0 1.41-.91 2.72-2 3.25V8.59c.58-.45 1-1.27 1-2.09C10 5.22 8.98 4 8 4H4c-.98 0-2 1.22-2 2.5S3 9 4 9zm9-3h-1v1h1c1 0 2 1.22 2 2.5S13.98 12 13 12H9c-.98 0-2-1.22-2-2.5 0-.83.42-1.64 1-2.09V6.25c-1.09.53-2 1.84-2 3.25C6 11.31 7.55 13 9 13h4c1.45 0 3-1.69 3-3.5S14.5 6 13 6z\"\n  })))), \"Podcasts\"), mdx(\"h4\", {\n    \"id\": \"from-last-year\"\n  }, mdx(\"a\", _extends({\n    parentName: \"h4\"\n  }, {\n    \"href\": \"#from-last-year\",\n    \"aria-label\": \"from last year permalink\",\n    \"className\": \"anchor\"\n  }), mdx(\"svg\", _extends({\n    parentName: \"a\"\n  }, {\n    \"aria-hidden\": \"true\",\n    \"focusable\": \"false\",\n    \"height\": \"16\",\n    \"version\": \"1.1\",\n    \"viewBox\": \"0 0 16 16\",\n    \"width\": \"16\"\n  }), mdx(\"path\", _extends({\n    parentName: \"svg\"\n  }, {\n    \"fillRule\": \"evenodd\",\n    \"d\": \"M4 9h1v1H4c-1.5 0-3-1.69-3-3.5S2.55 3 4 3h4c1.45 0 3 1.69 3 3.5 0 1.41-.91 2.72-2 3.25V8.59c.58-.45 1-1.27 1-2.09C10 5.22 8.98 4 8 4H4c-.98 0-2 1.22-2 2.5S3 9 4 9zm9-3h-1v1h1c1 0 2 1.22 2 2.5S13.98 12 13 12H9c-.98 0-2-1.22-2-2.5 0-.83.42-1.64 1-2.09V6.25c-1.09.53-2 1.84-2 3.25C6 11.31 7.55 13 9 13h4c1.45 0 3-1.69 3-3.5S14.5 6 13 6z\"\n  })))), \"From last year\"), mdx(\"ul\", null, mdx(\"li\", {\n    parentName: \"ul\"\n  }, mdx(\"a\", _extends({\n    parentName: \"li\"\n  }, {\n    \"href\": \"https://castbox.fm/channel/Changelog-Master-Feed-id397660?country=us\"\n  }), \"Changelog Master Feed\"), \" Multiple software development podcasts in one, plus one Brain Science podcast\"), mdx(\"li\", {\n    parentName: \"ul\"\n  }, mdx(\"a\", _extends({\n    parentName: \"li\"\n  }, {\n    \"href\": \"https://castbox.fm/channel/Under-the-Radar-id2378?country=us\"\n  }), \"Under the Radar\"), \" Independent iOS development\"), mdx(\"li\", {\n    parentName: \"ul\"\n  }, mdx(\"a\", _extends({\n    parentName: \"li\"\n  }, {\n    \"href\": \"https://castbox.fm/channel/The-Freelancers'-Show-id325583?country=us\"\n  }), \"The Freelancers' Show\"), \" Freelance software development\"), mdx(\"li\", {\n    parentName: \"ul\"\n  }, mdx(\"a\", _extends({\n    parentName: \"li\"\n  }, {\n    \"href\": \"https://castbox.fm/channel/Entreprogrammers-Podcast-id38063?country=us\"\n  }), \"Entreprogrammers\"), \" Programmers who are entrepreneurs\"), mdx(\"li\", {\n    parentName: \"ul\"\n  }, mdx(\"a\", _extends({\n    parentName: \"li\"\n  }, {\n    \"href\": \"https://castbox.fm/channel/CodePen-Radio-id218322?country=us\"\n  }), \"CodePen Radio\"), \" Software development centered around CodePen\"), mdx(\"li\", {\n    parentName: \"ul\"\n  }, mdx(\"a\", _extends({\n    parentName: \"li\"\n  }, {\n    \"href\": \"https://castbox.fm/channel/All-JavaScript-Podcasts-by-Devchat.tv-id325284?country=us\"\n  }), \"All JavaScript Podcasts by Devchat\"), \" Multiple podcasts that focus on JavaScript\"), mdx(\"li\", {\n    parentName: \"ul\"\n  }, mdx(\"a\", _extends({\n    parentName: \"li\"\n  }, {\n    \"href\": \"https://castbox.fm/channel/Software-Engineering-Daily-id409522?country=us\"\n  }), \"Software Engineering Daily\"), \" Interviews with technical people about software\"), mdx(\"li\", {\n    parentName: \"ul\"\n  }, mdx(\"a\", _extends({\n    parentName: \"li\"\n  }, {\n    \"href\": \"https://castbox.fm/channel/Soft-Skills-Engineering-id231452?country=us\"\n  }), \"Soft-Skills Engineering\"), \" Softskills in software engineering\")), mdx(\"h4\", {\n    \"id\": \"added\"\n  }, mdx(\"a\", _extends({\n    parentName: \"h4\"\n  }, {\n    \"href\": \"#added\",\n    \"aria-label\": \"added permalink\",\n    \"className\": \"anchor\"\n  }), mdx(\"svg\", _extends({\n    parentName: \"a\"\n  }, {\n    \"aria-hidden\": \"true\",\n    \"focusable\": \"false\",\n    \"height\": \"16\",\n    \"version\": \"1.1\",\n    \"viewBox\": \"0 0 16 16\",\n    \"width\": \"16\"\n  }), mdx(\"path\", _extends({\n    parentName: \"svg\"\n  }, {\n    \"fillRule\": \"evenodd\",\n    \"d\": \"M4 9h1v1H4c-1.5 0-3-1.69-3-3.5S2.55 3 4 3h4c1.45 0 3 1.69 3 3.5 0 1.41-.91 2.72-2 3.25V8.59c.58-.45 1-1.27 1-2.09C10 5.22 8.98 4 8 4H4c-.98 0-2 1.22-2 2.5S3 9 4 9zm9-3h-1v1h1c1 0 2 1.22 2 2.5S13.98 12 13 12H9c-.98 0-2-1.22-2-2.5 0-.83.42-1.64 1-2.09V6.25c-1.09.53-2 1.84-2 3.25C6 11.31 7.55 13 9 13h4c1.45 0 3-1.69 3-3.5S14.5 6 13 6z\"\n  })))), \"Added\"), mdx(\"ul\", null, mdx(\"li\", {\n    parentName: \"ul\"\n  }, mdx(\"a\", _extends({\n    parentName: \"li\"\n  }, {\n    \"href\": \"https://castbox.fm/channel/Syntax-Tasty-Web-Development-Treats-id938004?country=us\"\n  }), \"Syntax\"), \" Tips/tricks for web development\"), mdx(\"li\", {\n    parentName: \"ul\"\n  }, mdx(\"a\", _extends({\n    parentName: \"li\"\n  }, {\n    \"href\": \"https://castbox.fm/channel/The-Bike-Shed-id491181?country=us\"\n  }), \"The Bike Shed\"), \" Software development\"), mdx(\"li\", {\n    parentName: \"ul\"\n  }, mdx(\"a\", _extends({\n    parentName: \"li\"\n  }, {\n    \"href\": \"https://castbox.fm/channel/The-Meb-Faber-Show-id351652?country=us\"\n  }), \"The Meb Faber Show\"), \" Investment\"), mdx(\"li\", {\n    parentName: \"ul\"\n  }, mdx(\"a\", _extends({\n    parentName: \"li\"\n  }, {\n    \"href\": \"https://castbox.fm/channel/the-NewsWorthy-id1014399?country=us\"\n  }), \"The NewsWorthy\"), \" Quick general news updates\"), mdx(\"li\", {\n    parentName: \"ul\"\n  }, mdx(\"a\", _extends({\n    parentName: \"li\"\n  }, {\n    \"href\": \"https://castbox.fm/channel/On-Call-Nightmares-Podcast-id1778442?country=us\"\n  }), \"On Call Nightmares\"), \" Software development retrospectives\"), mdx(\"li\", {\n    parentName: \"ul\"\n  }, mdx(\"a\", _extends({\n    parentName: \"li\"\n  }, {\n    \"href\": \"https://castbox.fm/channel/2215699?country=us\"\n  }), \"Techmeme Ride Home\"), \" Quick tech news updates\"), mdx(\"li\", {\n    parentName: \"ul\"\n  }, mdx(\"a\", _extends({\n    parentName: \"li\"\n  }, {\n    \"href\": \"https://castbox.fm/channel/2181696?country=us\"\n  }), \"Election Ride Home\"), \" Quick election news updates\"), mdx(\"li\", {\n    parentName: \"ul\"\n  }, mdx(\"a\", _extends({\n    parentName: \"li\"\n  }, {\n    \"href\": \"https://castbox.fm/channel/Naval-id2030098?country=us\"\n  }), \"Naval\"), \" Intriguing insights life/entrepreneurship/ wealth creation\"), mdx(\"li\", {\n    parentName: \"ul\"\n  }, mdx(\"a\", _extends({\n    parentName: \"li\"\n  }, {\n    \"href\": \"https://castbox.fm/channel/Darknet-Diaries-id1468651?country=us\"\n  }), \"Darknet Diaries\"), \" Amazing secret stories related to technology (cybercrime)\"), mdx(\"li\", {\n    parentName: \"ul\"\n  }, mdx(\"a\", _extends({\n    parentName: \"li\"\n  }, {\n    \"href\": \"https://castbox.fm/channel/Today-in-Digital-Marketing-id2372870?country=us\"\n  }), \"Today in Digital Marketing\"), \" Quick marketing news updates\"), mdx(\"li\", {\n    parentName: \"ul\"\n  }, mdx(\"a\", _extends({\n    parentName: \"li\"\n  }, {\n    \"href\": \"https://castbox.fm/channel/Hackable%3F-id970566\"\n  }), \"Hackable?\"), \" Stories of everything related to hacking (mainly how secure things really are)\"), mdx(\"li\", {\n    parentName: \"ul\"\n  }, mdx(\"a\", _extends({\n    parentName: \"li\"\n  }, {\n    \"href\": \"https://castbox.fm/channel/Pessimists-Archive-Podcast-id338179\"\n  }), \"Pessimists Archive\"), \" Stories of people resisting new things\"), mdx(\"li\", {\n    parentName: \"ul\"\n  }, mdx(\"a\", _extends({\n    parentName: \"li\"\n  }, {\n    \"href\": \"https://castbox.fm/channel/Problem-Solvers-id980712\"\n  }), \"Problem Solvers\"), \" Stories about entrepreneurs solving problems and how they handle them\"), mdx(\"li\", {\n    parentName: \"ul\"\n  }, mdx(\"a\", _extends({\n    parentName: \"li\"\n  }, {\n    \"href\": \"https://castbox.fm/channel/Malicious-Life-id943414\"\n  }), \"Malicious Life\"), \" Stories about hackers and how they got into hacking\"), mdx(\"li\", {\n    parentName: \"ul\"\n  }, mdx(\"a\", _extends({\n    parentName: \"li\"\n  }, {\n    \"href\": \"https://castbox.fm/channel/EconTalk-id2734\"\n  }), \"EconTalk\"), \" talk show about economics in daily life\")), mdx(\"h4\", {\n    \"id\": \"dropped\"\n  }, mdx(\"a\", _extends({\n    parentName: \"h4\"\n  }, {\n    \"href\": \"#dropped\",\n    \"aria-label\": \"dropped permalink\",\n    \"className\": \"anchor\"\n  }), mdx(\"svg\", _extends({\n    parentName: \"a\"\n  }, {\n    \"aria-hidden\": \"true\",\n    \"focusable\": \"false\",\n    \"height\": \"16\",\n    \"version\": \"1.1\",\n    \"viewBox\": \"0 0 16 16\",\n    \"width\": \"16\"\n  }), mdx(\"path\", _extends({\n    parentName: \"svg\"\n  }, {\n    \"fillRule\": \"evenodd\",\n    \"d\": \"M4 9h1v1H4c-1.5 0-3-1.69-3-3.5S2.55 3 4 3h4c1.45 0 3 1.69 3 3.5 0 1.41-.91 2.72-2 3.25V8.59c.58-.45 1-1.27 1-2.09C10 5.22 8.98 4 8 4H4c-.98 0-2 1.22-2 2.5S3 9 4 9zm9-3h-1v1h1c1 0 2 1.22 2 2.5S13.98 12 13 12H9c-.98 0-2-1.22-2-2.5 0-.83.42-1.64 1-2.09V6.25c-1.09.53-2 1.84-2 3.25C6 11.31 7.55 13 9 13h4c1.45 0 3-1.69 3-3.5S14.5 6 13 6z\"\n  })))), \"Dropped\"), mdx(\"ul\", null, mdx(\"li\", {\n    parentName: \"ul\"\n  }, mdx(\"a\", _extends({\n    parentName: \"li\"\n  }, {\n    \"href\": \"https://castbox.fm/channel/DevelopersHangout-id491567?country=us\"\n  }), \"DevelopersHangout\"), \" No longer producing new episodes\"), mdx(\"li\", {\n    parentName: \"ul\"\n  }, mdx(\"a\", _extends({\n    parentName: \"li\"\n  }, {\n    \"href\": \"https://castbox.fm/channel/Late-Nights-with-Trav-and-Los-id491136?country=us\"\n  }), \"Late Nights with Trav and Los\"), \" No longer producing new episodes\"), mdx(\"li\", {\n    parentName: \"ul\"\n  }, mdx(\"a\", _extends({\n    parentName: \"li\"\n  }, {\n    \"href\": \"https://castbox.fm/channel/NodeUp-id2345?country=us\"\n  }), \"NodeUp\"), \" No longer producing new episodes\"), mdx(\"li\", {\n    parentName: \"ul\"\n  }, mdx(\"a\", _extends({\n    parentName: \"li\"\n  }, {\n    \"href\": \"https://castbox.fm/channel/Sh*t-They-Don%E2%80%99t-Tell-You-with-Nikki-Limo-and-Steve-Greene-id1500855?country=us\"\n  }), \"Sh*t They Don't Tell You\"), \" Content quality below my standard (had good episodes but since it is a weekly podcast most of the new episodes are just random conversation without much valuable information)\")), mdx(\"h3\", {\n    \"id\": \"weight-graph\"\n  }, mdx(\"a\", _extends({\n    parentName: \"h3\"\n  }, {\n    \"href\": \"#weight-graph\",\n    \"aria-label\": \"weight graph permalink\",\n    \"className\": \"anchor\"\n  }), mdx(\"svg\", _extends({\n    parentName: \"a\"\n  }, {\n    \"aria-hidden\": \"true\",\n    \"focusable\": \"false\",\n    \"height\": \"16\",\n    \"version\": \"1.1\",\n    \"viewBox\": \"0 0 16 16\",\n    \"width\": \"16\"\n  }), mdx(\"path\", _extends({\n    parentName: \"svg\"\n  }, {\n    \"fillRule\": \"evenodd\",\n    \"d\": \"M4 9h1v1H4c-1.5 0-3-1.69-3-3.5S2.55 3 4 3h4c1.45 0 3 1.69 3 3.5 0 1.41-.91 2.72-2 3.25V8.59c.58-.45 1-1.27 1-2.09C10 5.22 8.98 4 8 4H4c-.98 0-2 1.22-2 2.5S3 9 4 9zm9-3h-1v1h1c1 0 2 1.22 2 2.5S13.98 12 13 12H9c-.98 0-2-1.22-2-2.5 0-.83.42-1.64 1-2.09V6.25c-1.09.53-2 1.84-2 3.25C6 11.31 7.55 13 9 13h4c1.45 0 3-1.69 3-3.5S14.5 6 13 6z\"\n  })))), \"Weight graph\"), mdx(Gallery, {\n    photos: [{\n      src: weight,\n      width: 604,\n      height: 340\n    }],\n    mdxType: \"Gallery\"\n  }), mdx(\"h3\", {\n    \"id\": \"cities-visited\"\n  }, mdx(\"a\", _extends({\n    parentName: \"h3\"\n  }, {\n    \"href\": \"#cities-visited\",\n    \"aria-label\": \"cities visited permalink\",\n    \"className\": \"anchor\"\n  }), mdx(\"svg\", _extends({\n    parentName: \"a\"\n  }, {\n    \"aria-hidden\": \"true\",\n    \"focusable\": \"false\",\n    \"height\": \"16\",\n    \"version\": \"1.1\",\n    \"viewBox\": \"0 0 16 16\",\n    \"width\": \"16\"\n  }), mdx(\"path\", _extends({\n    parentName: \"svg\"\n  }, {\n    \"fillRule\": \"evenodd\",\n    \"d\": \"M4 9h1v1H4c-1.5 0-3-1.69-3-3.5S2.55 3 4 3h4c1.45 0 3 1.69 3 3.5 0 1.41-.91 2.72-2 3.25V8.59c.58-.45 1-1.27 1-2.09C10 5.22 8.98 4 8 4H4c-.98 0-2 1.22-2 2.5S3 9 4 9zm9-3h-1v1h1c1 0 2 1.22 2 2.5S13.98 12 13 12H9c-.98 0-2-1.22-2-2.5 0-.83.42-1.64 1-2.09V6.25c-1.09.53-2 1.84-2 3.25C6 11.31 7.55 13 9 13h4c1.45 0 3-1.69 3-3.5S14.5 6 13 6z\"\n  })))), \"Cities visited\"), mdx(\"div\", {\n    \"className\": \"gatsby-resp-iframe-wrapper\",\n    \"style\": {\n      \"paddingBottom\": \"75%\",\n      \"position\": \"relative\",\n      \"height\": \"0\",\n      \"overflow\": \"hidden\"\n    }\n  }, \" \", mdx(\"iframe\", _extends({\n    parentName: \"div\"\n  }, {\n    \"src\": \"https://www.google.com/maps/d/embed?mid=12JTCfBpwNPqu_WUNBuhKr-VgHglg9tT7&hl=en\",\n    \"style\": {\n      \"position\": \"absolute\",\n      \"top\": \"0\",\n      \"left\": \"0\",\n      \"width\": \"100%\",\n      \"height\": \"100%\"\n    }\n  })), \" \"));\n}\n;\nMDXContent.isMDXComponent = true;","timeToRead":21,"excerpt":"Introduction Last year I did a year review and I really enjoyed reflecting on it. I had decided that I will keep documenting each year's","frontmatter":{"title":"Year review 2019","coverURL":"","coverFile":{"publicURL":"/static/grad4-a29b442edb96572414e8ed0a13b97eb5.jpg"},"date":"January 01, 2020","author":"Fadee Kannah","authorTwitter":"@fadeenk","publisher":"MrKannah.com","dateModified":"2019-02-24T00:00:00.000Z","category":"Personal","tags":["YearReview","Travel","Business","Work"]},"fields":{"slug":"/blog/year-review-2019","date":"2020-01-01T08:00:00.000Z"}}},"pageContext":{"isCreatedByStatefulCreatePages":false,"slug":"/blog/year-review-2019"}}}