{"data":{"mdx":{"code":{"body":"function _extends() { _extends = Object.assign || function (target) { for (var i = 1; i < arguments.length; i++) { var source = arguments[i]; for (var key in source) { if (Object.prototype.hasOwnProperty.call(source, key)) { target[key] = source[key]; } } } return target; }; return _extends.apply(this, arguments); }\n\nfunction _objectWithoutProperties(source, excluded) { if (source == null) return {}; var target = _objectWithoutPropertiesLoose(source, excluded); var key, i; if (Object.getOwnPropertySymbols) { var sourceSymbolKeys = Object.getOwnPropertySymbols(source); for (i = 0; i < sourceSymbolKeys.length; i++) { key = sourceSymbolKeys[i]; if (excluded.indexOf(key) >= 0) continue; if (!Object.prototype.propertyIsEnumerable.call(source, key)) continue; target[key] = source[key]; } } return target; }\n\nfunction _objectWithoutPropertiesLoose(source, excluded) { if (source == null) return {}; var target = {}; var sourceKeys = Object.keys(source); var key, i; for (i = 0; i < sourceKeys.length; i++) { key = sourceKeys[i]; if (excluded.indexOf(key) >= 0) continue; target[key] = source[key]; } return target; }\n\n/* @jsx mdx */\nvar _frontmatter = {\n  \"title\": \"F.U. Money\",\n  \"coverFile\": \"./fuMoney.png\",\n  \"coverURL\": \"\",\n  \"author\": \"Fadee Kannah\",\n  \"authorTwitter\": \"@fadeenk\",\n  \"publisher\": \"MrKannah.com\",\n  \"dateModified\": \"2019-02-24T00:00:00.000Z\",\n  \"date\": \"2019-01-21T00:00:00.000Z\",\n  \"completed\": \"2019-01-15T00:00:00.000Z\",\n  \"category\": \"Books\",\n  \"tags\": [\"Business\", \"Entrepreneurship\", \"StartUps\", \"Money\"]\n};\n\nvar makeShortcode = function makeShortcode(name) {\n  return function MDXDefaultShortcode(props) {\n    console.warn(\"Component \" + name + \" was not imported, exported, or provided by MDXProvider as global scope\");\n    return mdx(\"div\", props);\n  };\n};\n\nvar layoutProps = {\n  _frontmatter: _frontmatter\n};\nvar MDXLayout = \"wrapper\";\nreturn function MDXContent(_ref) {\n  var components = _ref.components,\n      props = _objectWithoutProperties(_ref, [\"components\"]);\n\n  return mdx(MDXLayout, _extends({}, layoutProps, props, {\n    components: components,\n    mdxType: \"MDXLayout\"\n  }), mdx(\"p\", null, mdx(\"figure\", _extends({\n    parentName: \"p\"\n  }, {\n    \"className\": \"gatsby-resp-image-figure\",\n    \"style\": {}\n  }), \"\\n    \", mdx(\"a\", _extends({\n    parentName: \"figure\"\n  }, {\n    \"className\": \"gatsby-resp-image-link\",\n    \"href\": \"/static/6463c0453e954c7d5953fec98345751f/34e8a/fuMoney.png\",\n    \"style\": {\n      \"display\": \"block\"\n    },\n    \"target\": \"_blank\",\n    \"rel\": [\"noopener\"]\n  }), \"\\n    \", mdx(\"span\", _extends({\n    parentName: \"a\"\n  }, {\n    \"className\": \"gatsby-resp-image-wrapper\",\n    \"style\": {\n      \"position\": \"relative\",\n      \"display\": \"block\",\n      \"marginLeft\": \"auto\",\n      \"marginRight\": \"auto\",\n      \"maxWidth\": \"600px\"\n    }\n  }), \"\\n    \", mdx(\"span\", _extends({\n    parentName: \"span\"\n  }, {\n    \"className\": \"gatsby-resp-image-background-image\",\n    \"style\": {\n      \"paddingBottom\": \"97.33333333333333%\",\n      \"position\": \"relative\",\n      \"bottom\": \"0px\",\n      \"left\": \"0px\",\n      \"backgroundSize\": \"cover\",\n      \"display\": \"block\"\n    }\n  })), \"\\n    \", mdx(\"img\", _extends({\n    parentName: \"span\"\n  }, {\n    \"className\": \"gatsby-resp-image-image\",\n    \"style\": {\n      \"width\": \"100%\",\n      \"height\": \"100%\",\n      \"margin\": \"0px\",\n      \"verticalAlign\": \"middle\",\n      \"position\": \"absolute\",\n      \"top\": \"0px\",\n      \"left\": \"0px\",\n      \"boxShadow\": \"inset 0px 0px 0px 400px white\"\n    },\n    \"alt\": \"Cover\",\n    \"title\": \"\",\n    \"src\": \"/static/6463c0453e954c7d5953fec98345751f/34e8a/fuMoney.png\",\n    \"srcSet\": [\"/static/6463c0453e954c7d5953fec98345751f/acf4b/fuMoney.png 173w\", \"/static/6463c0453e954c7d5953fec98345751f/fc834/fuMoney.png 345w\", \"/static/6463c0453e954c7d5953fec98345751f/34e8a/fuMoney.png 600w\"],\n    \"sizes\": \"(max-width: 600px) 100vw, 600px\"\n  })), \"\\n  \"), \"\\n  \"), \"\\n    \", mdx(\"figcaption\", _extends({\n    parentName: \"figure\"\n  }, {\n    \"className\": \"gatsby-resp-image-figcaption\"\n  }), \"Cover\"), \"\\n  \")), mdx(\"h2\", {\n    \"id\": \"introduction\"\n  }, mdx(\"a\", _extends({\n    parentName: \"h2\"\n  }, {\n    \"href\": \"#introduction\",\n    \"aria-label\": \"introduction permalink\",\n    \"className\": \"anchor\"\n  }), mdx(\"svg\", _extends({\n    parentName: \"a\"\n  }, {\n    \"aria-hidden\": \"true\",\n    \"focusable\": \"false\",\n    \"height\": \"16\",\n    \"version\": \"1.1\",\n    \"viewBox\": \"0 0 16 16\",\n    \"width\": \"16\"\n  }), mdx(\"path\", _extends({\n    parentName: \"svg\"\n  }, {\n    \"fillRule\": \"evenodd\",\n    \"d\": \"M4 9h1v1H4c-1.5 0-3-1.69-3-3.5S2.55 3 4 3h4c1.45 0 3 1.69 3 3.5 0 1.41-.91 2.72-2 3.25V8.59c.58-.45 1-1.27 1-2.09C10 5.22 8.98 4 8 4H4c-.98 0-2 1.22-2 2.5S3 9 4 9zm9-3h-1v1h1c1 0 2 1.22 2 2.5S13.98 12 13 12H9c-.98 0-2-1.22-2-2.5 0-.83.42-1.64 1-2.09V6.25c-1.09.53-2 1.84-2 3.25C6 11.31 7.55 13 9 13h4c1.45 0 3-1.69 3-3.5S14.5 6 13 6z\"\n  })))), \"Introduction\"), mdx(\"p\", null, \"This was an unplanned read! Although my to-read booklist is full of books to go through, this book ended up being the first book I completed this year. The book was handed to me in both audiobook and eBook forms for \", mdx(\"a\", _extends({\n    parentName: \"p\"\n  }, {\n    \"href\": \"https://www.fumoney.com/free-ebook\"\n  }), \"free\"), \"! Making it extremely easy to load it on my phone and enjoy it.\"), mdx(\"h2\", {\n    \"id\": \"the-author\"\n  }, mdx(\"a\", _extends({\n    parentName: \"h2\"\n  }, {\n    \"href\": \"#the-author\",\n    \"aria-label\": \"the author permalink\",\n    \"className\": \"anchor\"\n  }), mdx(\"svg\", _extends({\n    parentName: \"a\"\n  }, {\n    \"aria-hidden\": \"true\",\n    \"focusable\": \"false\",\n    \"height\": \"16\",\n    \"version\": \"1.1\",\n    \"viewBox\": \"0 0 16 16\",\n    \"width\": \"16\"\n  }), mdx(\"path\", _extends({\n    parentName: \"svg\"\n  }, {\n    \"fillRule\": \"evenodd\",\n    \"d\": \"M4 9h1v1H4c-1.5 0-3-1.69-3-3.5S2.55 3 4 3h4c1.45 0 3 1.69 3 3.5 0 1.41-.91 2.72-2 3.25V8.59c.58-.45 1-1.27 1-2.09C10 5.22 8.98 4 8 4H4c-.98 0-2 1.22-2 2.5S3 9 4 9zm9-3h-1v1h1c1 0 2 1.22 2 2.5S13.98 12 13 12H9c-.98 0-2-1.22-2-2.5 0-.83.42-1.64 1-2.09V6.25c-1.09.53-2 1.84-2 3.25C6 11.31 7.55 13 9 13h4c1.45 0 3-1.69 3-3.5S14.5 6 13 6z\"\n  })))), \"The Author\"), mdx(\"p\", null, \"Dan Lok is a successful businessman and entrepreneur, that made his wealth through multiple businesses on the internet. He has published many books and has large social media presence. He was born in Hong Kong then moved to Canada at the age of 14. He offers different courses and trainings for different things. His newest project is the \", mdx(\"a\", _extends({\n    parentName: \"p\"\n  }, {\n    \"href\": \"https://www.fumoneywithjohn.com/now\"\n  }), \"\\u201CHigh-Ticket Closers\\u201D\"), \" program.\"), mdx(\"h2\", {\n    \"id\": \"the-verdict\"\n  }, mdx(\"a\", _extends({\n    parentName: \"h2\"\n  }, {\n    \"href\": \"#the-verdict\",\n    \"aria-label\": \"the verdict permalink\",\n    \"className\": \"anchor\"\n  }), mdx(\"svg\", _extends({\n    parentName: \"a\"\n  }, {\n    \"aria-hidden\": \"true\",\n    \"focusable\": \"false\",\n    \"height\": \"16\",\n    \"version\": \"1.1\",\n    \"viewBox\": \"0 0 16 16\",\n    \"width\": \"16\"\n  }), mdx(\"path\", _extends({\n    parentName: \"svg\"\n  }, {\n    \"fillRule\": \"evenodd\",\n    \"d\": \"M4 9h1v1H4c-1.5 0-3-1.69-3-3.5S2.55 3 4 3h4c1.45 0 3 1.69 3 3.5 0 1.41-.91 2.72-2 3.25V8.59c.58-.45 1-1.27 1-2.09C10 5.22 8.98 4 8 4H4c-.98 0-2 1.22-2 2.5S3 9 4 9zm9-3h-1v1h1c1 0 2 1.22 2 2.5S13.98 12 13 12H9c-.98 0-2-1.22-2-2.5 0-.83.42-1.64 1-2.09V6.25c-1.09.53-2 1.84-2 3.25C6 11.31 7.55 13 9 13h4c1.45 0 3-1.69 3-3.5S14.5 6 13 6z\"\n  })))), \"The Verdict\"), mdx(\"p\", null, \"The book is interesting, it attempts to change your perspective on money and how to make money. That itself is ok, however beware the author\\u2019s intentions of writing this book. Although, he has some good and few great points, he is a salesman. He is selling you his other offerings: books, mentorship programs and training courses.\"), mdx(\"p\", null, \"The book is an easy read. Dan keeps it real, the book is written exactly how he talks. He does not censor his thoughts, which is something that I appreciate in people. The audiobook was a blast to listen to, since it was voiced by him. Additionally, the eBook is full of short words of wisdom \\u201CLokism\\u201D, YouTube videos and exercises that make things more interesting than the usual text only books.\"), mdx(\"p\", null, \"I would still recommend this book, especially if you want to change your financial situation but don't know how or where to start. Just don't expect to get a spelled-out answer on how to get rich. The book will give you tips and help you get into the right mindset to get to where you want to be financially. If you don\\u2019t want to go through the whole book, you can keep reading to get the highlights and things I got out of this book.\"), mdx(\"h2\", {\n    \"id\": \"the-summary\"\n  }, mdx(\"a\", _extends({\n    parentName: \"h2\"\n  }, {\n    \"href\": \"#the-summary\",\n    \"aria-label\": \"the summary permalink\",\n    \"className\": \"anchor\"\n  }), mdx(\"svg\", _extends({\n    parentName: \"a\"\n  }, {\n    \"aria-hidden\": \"true\",\n    \"focusable\": \"false\",\n    \"height\": \"16\",\n    \"version\": \"1.1\",\n    \"viewBox\": \"0 0 16 16\",\n    \"width\": \"16\"\n  }), mdx(\"path\", _extends({\n    parentName: \"svg\"\n  }, {\n    \"fillRule\": \"evenodd\",\n    \"d\": \"M4 9h1v1H4c-1.5 0-3-1.69-3-3.5S2.55 3 4 3h4c1.45 0 3 1.69 3 3.5 0 1.41-.91 2.72-2 3.25V8.59c.58-.45 1-1.27 1-2.09C10 5.22 8.98 4 8 4H4c-.98 0-2 1.22-2 2.5S3 9 4 9zm9-3h-1v1h1c1 0 2 1.22 2 2.5S13.98 12 13 12H9c-.98 0-2-1.22-2-2.5 0-.83.42-1.64 1-2.09V6.25c-1.09.53-2 1.84-2 3.25C6 11.31 7.55 13 9 13h4c1.45 0 3-1.69 3-3.5S14.5 6 13 6z\"\n  })))), \"The Summary\"), mdx(\"h3\", {\n    \"id\": \"what-is-fu-money\"\n  }, mdx(\"a\", _extends({\n    parentName: \"h3\"\n  }, {\n    \"href\": \"#what-is-fu-money\",\n    \"aria-label\": \"what is fu money permalink\",\n    \"className\": \"anchor\"\n  }), mdx(\"svg\", _extends({\n    parentName: \"a\"\n  }, {\n    \"aria-hidden\": \"true\",\n    \"focusable\": \"false\",\n    \"height\": \"16\",\n    \"version\": \"1.1\",\n    \"viewBox\": \"0 0 16 16\",\n    \"width\": \"16\"\n  }), mdx(\"path\", _extends({\n    parentName: \"svg\"\n  }, {\n    \"fillRule\": \"evenodd\",\n    \"d\": \"M4 9h1v1H4c-1.5 0-3-1.69-3-3.5S2.55 3 4 3h4c1.45 0 3 1.69 3 3.5 0 1.41-.91 2.72-2 3.25V8.59c.58-.45 1-1.27 1-2.09C10 5.22 8.98 4 8 4H4c-.98 0-2 1.22-2 2.5S3 9 4 9zm9-3h-1v1h1c1 0 2 1.22 2 2.5S13.98 12 13 12H9c-.98 0-2-1.22-2-2.5 0-.83.42-1.64 1-2.09V6.25c-1.09.53-2 1.84-2 3.25C6 11.31 7.55 13 9 13h4c1.45 0 3-1.69 3-3.5S14.5 6 13 6z\"\n  })))), \"What is F.U. Money?\"), mdx(\"p\", null, \"F.U. Money is a simple concept, make enough money where you achieve financial freedom. The freedom of not having to answer to anyone you don\\u2019t want to. This concept is different from financial independence where you enjoy the lifestyle you want without having to do anything you don\\u2019t want to or work. F.U. Money is not as powerful as financial independence. But it sure is close enough for most people.\"), mdx(\"h3\", {\n    \"id\": \"what-is-your-magic-number\"\n  }, mdx(\"a\", _extends({\n    parentName: \"h3\"\n  }, {\n    \"href\": \"#what-is-your-magic-number\",\n    \"aria-label\": \"what is your magic number permalink\",\n    \"className\": \"anchor\"\n  }), mdx(\"svg\", _extends({\n    parentName: \"a\"\n  }, {\n    \"aria-hidden\": \"true\",\n    \"focusable\": \"false\",\n    \"height\": \"16\",\n    \"version\": \"1.1\",\n    \"viewBox\": \"0 0 16 16\",\n    \"width\": \"16\"\n  }), mdx(\"path\", _extends({\n    parentName: \"svg\"\n  }, {\n    \"fillRule\": \"evenodd\",\n    \"d\": \"M4 9h1v1H4c-1.5 0-3-1.69-3-3.5S2.55 3 4 3h4c1.45 0 3 1.69 3 3.5 0 1.41-.91 2.72-2 3.25V8.59c.58-.45 1-1.27 1-2.09C10 5.22 8.98 4 8 4H4c-.98 0-2 1.22-2 2.5S3 9 4 9zm9-3h-1v1h1c1 0 2 1.22 2 2.5S13.98 12 13 12H9c-.98 0-2-1.22-2-2.5 0-.83.42-1.64 1-2.09V6.25c-1.09.53-2 1.84-2 3.25C6 11.31 7.55 13 9 13h4c1.45 0 3-1.69 3-3.5S14.5 6 13 6z\"\n  })))), \"What is your magic number?\"), mdx(\"p\", null, \"The first section of the book is dedicated to understanding the concept of F.U. money as well as getting in the right mindset to achieve it. Just like everything else in life, it starts with setting a goal and focusing on achieving it. One must have a dollar amount set in mind and have a plan to get there. The cool thing about this book is the exercises included at the end of each chapter.\"), mdx(\"p\", null, \"Dan wants the reader to set F.U. Money Targets (F.U.M.T.s). These targets are things you can get/do with the money and they will serve as a guide to finding your F.U. Money number. Below is his personal list. I am still working on mine\\u2026\"), mdx(\"p\", null, mdx(\"figure\", _extends({\n    parentName: \"p\"\n  }, {\n    \"className\": \"gatsby-resp-image-figure\",\n    \"style\": {}\n  }), \"\\n    \", mdx(\"a\", _extends({\n    parentName: \"figure\"\n  }, {\n    \"className\": \"gatsby-resp-image-link\",\n    \"href\": \"/static/fb33548a8800da05588ebaf6c6faa945/062c7/fumts.png\",\n    \"style\": {\n      \"display\": \"block\"\n    },\n    \"target\": \"_blank\",\n    \"rel\": [\"noopener\"]\n  }), \"\\n    \", mdx(\"span\", _extends({\n    parentName: \"a\"\n  }, {\n    \"className\": \"gatsby-resp-image-wrapper\",\n    \"style\": {\n      \"position\": \"relative\",\n      \"display\": \"block\",\n      \"marginLeft\": \"auto\",\n      \"marginRight\": \"auto\",\n      \"maxWidth\": \"459px\"\n    }\n  }), \"\\n    \", mdx(\"span\", _extends({\n    parentName: \"span\"\n  }, {\n    \"className\": \"gatsby-resp-image-background-image\",\n    \"style\": {\n      \"paddingBottom\": \"129.41176470588235%\",\n      \"position\": \"relative\",\n      \"bottom\": \"0px\",\n      \"left\": \"0px\",\n      \"backgroundSize\": \"cover\",\n      \"display\": \"block\"\n    }\n  })), \"\\n    \", mdx(\"img\", _extends({\n    parentName: \"span\"\n  }, {\n    \"className\": \"gatsby-resp-image-image\",\n    \"style\": {\n      \"width\": \"100%\",\n      \"height\": \"100%\",\n      \"margin\": \"0px\",\n      \"verticalAlign\": \"middle\",\n      \"position\": \"absolute\",\n      \"top\": \"0px\",\n      \"left\": \"0px\",\n      \"boxShadow\": \"inset 0px 0px 0px 400px white\"\n    },\n    \"alt\": \"FUMTs\",\n    \"title\": \"Page 39\",\n    \"src\": \"/static/fb33548a8800da05588ebaf6c6faa945/062c7/fumts.png\",\n    \"srcSet\": [\"/static/fb33548a8800da05588ebaf6c6faa945/acf4b/fumts.png 173w\", \"/static/fb33548a8800da05588ebaf6c6faa945/fc834/fumts.png 345w\", \"/static/fb33548a8800da05588ebaf6c6faa945/062c7/fumts.png 459w\"],\n    \"sizes\": \"(max-width: 459px) 100vw, 459px\"\n  })), \"\\n  \"), \"\\n  \"), \"\\n    \", mdx(\"figcaption\", _extends({\n    parentName: \"figure\"\n  }, {\n    \"className\": \"gatsby-resp-image-figcaption\"\n  }), \"Page 39\"), \"\\n  \")), mdx(\"hr\", null), mdx(\"h3\", {\n    \"id\": \"the-money-myths\"\n  }, mdx(\"a\", _extends({\n    parentName: \"h3\"\n  }, {\n    \"href\": \"#the-money-myths\",\n    \"aria-label\": \"the money myths permalink\",\n    \"className\": \"anchor\"\n  }), mdx(\"svg\", _extends({\n    parentName: \"a\"\n  }, {\n    \"aria-hidden\": \"true\",\n    \"focusable\": \"false\",\n    \"height\": \"16\",\n    \"version\": \"1.1\",\n    \"viewBox\": \"0 0 16 16\",\n    \"width\": \"16\"\n  }), mdx(\"path\", _extends({\n    parentName: \"svg\"\n  }, {\n    \"fillRule\": \"evenodd\",\n    \"d\": \"M4 9h1v1H4c-1.5 0-3-1.69-3-3.5S2.55 3 4 3h4c1.45 0 3 1.69 3 3.5 0 1.41-.91 2.72-2 3.25V8.59c.58-.45 1-1.27 1-2.09C10 5.22 8.98 4 8 4H4c-.98 0-2 1.22-2 2.5S3 9 4 9zm9-3h-1v1h1c1 0 2 1.22 2 2.5S13.98 12 13 12H9c-.98 0-2-1.22-2-2.5 0-.83.42-1.64 1-2.09V6.25c-1.09.53-2 1.84-2 3.25C6 11.31 7.55 13 9 13h4c1.45 0 3-1.69 3-3.5S14.5 6 13 6z\"\n  })))), \"The money myths\"), mdx(\"ul\", null, mdx(\"li\", {\n    parentName: \"ul\"\n  }, mdx(\"strong\", {\n    parentName: \"li\"\n  }, \"Money Can\\u2019t Buy Happiness\"), \": partially agree with this myth. Money can\\u2019t make everyone happy, but it can help by getting you the things that make you happy. However, one must be aware of the \", mdx(\"a\", _extends({\n    parentName: \"li\"\n  }, {\n    \"href\": \"https://www.investopedia.com/terms/h/hedonic-treadmill.asp\"\n  }), \"Hedonic Treadmill\"), \".\"), mdx(\"li\", {\n    parentName: \"ul\"\n  }, mdx(\"strong\", {\n    parentName: \"li\"\n  }, \"Rich People are Assholes\"), \": Completely agree. I have met quite a few rich people and majority of them were not assholes.\"), mdx(\"li\", {\n    parentName: \"ul\"\n  }, mdx(\"strong\", {\n    parentName: \"li\"\n  }, \"You Can Afford to Wait\"), \": Completely agree. This is especially accurate if one wants to retire early. Making money takes time and to make sure we get to enjoy it, we must get to it as soon as possible.\")), mdx(\"blockquote\", null, mdx(\"p\", {\n    parentName: \"blockquote\"\n  }, \"\\u201CThe real source of wealth and capital in this new era is not material things. It is the human mind, the human spirit, the human imagination, and our faith in the future.\\u201D\"), mdx(\"p\", {\n    parentName: \"blockquote\"\n  }, \"\\u2014 Steve Forbes, Billionaire Publisher\")), mdx(\"ul\", null, mdx(\"li\", {\n    parentName: \"ul\"\n  }, mdx(\"strong\", {\n    parentName: \"li\"\n  }, \"You Have to be Lucky\"), \": Partially agree. Indeed, you don\\u2019t need luck to be successful. However, getting lucky does not hurt. Luck can help give you an advantage to shorten the time to hitting your goals.\"), mdx(\"li\", {\n    parentName: \"ul\"\n  }, mdx(\"strong\", {\n    parentName: \"li\"\n  }, \"You Have to be a Cheapskate\"), \": Completely agree. Squeezing pennies won\\u2019t make you rich, it will just be an inconvenience. Additionally, why is one making money if he/she won\\u2019t enjoy it?\"), mdx(\"li\", {\n    parentName: \"ul\"\n  }, mdx(\"strong\", {\n    parentName: \"li\"\n  }, \"You Have to Get Rich Slow\"), \": Partially agree. Building wealth takes time however if things are not progressing one should take action.\"), mdx(\"li\", {\n    parentName: \"ul\"\n  }, mdx(\"strong\", {\n    parentName: \"li\"\n  }, \"You Have to Work Hard to Make Money\"), \": Neutral. Only working hard will not get you that far. Working smart will get you closer but not that far either. A combination of both will get you to the end of the world.\"), mdx(\"li\", {\n    parentName: \"ul\"\n  }, mdx(\"strong\", {\n    parentName: \"li\"\n  }, \"You Have to be Perfectly Ready\"), \": Completely agree. If one waits till they are ready to take action, they will be waiting forever and miss their chance. One can always learn, adapt and evolve as one tackles the challenges that come with seeking wealth.\")), mdx(\"hr\", null), mdx(\"h3\", {\n    \"id\": \"mindset-shift\"\n  }, mdx(\"a\", _extends({\n    parentName: \"h3\"\n  }, {\n    \"href\": \"#mindset-shift\",\n    \"aria-label\": \"mindset shift permalink\",\n    \"className\": \"anchor\"\n  }), mdx(\"svg\", _extends({\n    parentName: \"a\"\n  }, {\n    \"aria-hidden\": \"true\",\n    \"focusable\": \"false\",\n    \"height\": \"16\",\n    \"version\": \"1.1\",\n    \"viewBox\": \"0 0 16 16\",\n    \"width\": \"16\"\n  }), mdx(\"path\", _extends({\n    parentName: \"svg\"\n  }, {\n    \"fillRule\": \"evenodd\",\n    \"d\": \"M4 9h1v1H4c-1.5 0-3-1.69-3-3.5S2.55 3 4 3h4c1.45 0 3 1.69 3 3.5 0 1.41-.91 2.72-2 3.25V8.59c.58-.45 1-1.27 1-2.09C10 5.22 8.98 4 8 4H4c-.98 0-2 1.22-2 2.5S3 9 4 9zm9-3h-1v1h1c1 0 2 1.22 2 2.5S13.98 12 13 12H9c-.98 0-2-1.22-2-2.5 0-.83.42-1.64 1-2.09V6.25c-1.09.53-2 1.84-2 3.25C6 11.31 7.55 13 9 13h4c1.45 0 3-1.69 3-3.5S14.5 6 13 6z\"\n  })))), \"Mindset shift\"), mdx(\"ul\", null, mdx(\"li\", {\n    parentName: \"ul\"\n  }, mdx(\"strong\", {\n    parentName: \"li\"\n  }, \"Conventional Wisdom\"), \": There is a lot of wisdom that we can learn from other people. However, some of it is actually wrong. Take everything with a grain of salt and investigate it for yourself before following it. When someone tells you can\\u2019t do something, the response should be, yeah? (think and investigate it), watch me (then do it if you believe in it)!\")), mdx(\"blockquote\", null, mdx(\"p\", {\n    parentName: \"blockquote\"\n  }, \"\\u201CThis \\u2018telephone\\u2019 has too many shortcomings to be seriously considered as a means of communication.\\u201D\"), mdx(\"p\", {\n    parentName: \"blockquote\"\n  }, \" \\u2014 Western Union, Internal Memo, 1876\")), mdx(\"ul\", null, mdx(\"li\", {\n    parentName: \"ul\"\n  }, mdx(\"strong\", {\n    parentName: \"li\"\n  }, \"The Most Important Thing You Can Do Today\"), \": Take action that sets you on the path to making your F.U. Money! Lots of people are afraid of taking risks and would rather wait. Bill Gates dropped out of Harvard, one of the most prestigious schools in the US, to pursue the opportunity of building software. If he had NOT taken action, we would have not had Microsoft and all the things built on top of it.\"), mdx(\"li\", {\n    parentName: \"ul\"\n  }, mdx(\"strong\", {\n    parentName: \"li\"\n  }, \"You Can Make Money or Excuses, Not Both\"), \": This is my favorite! A lot of people make all sort of excuses, which puts them into the victim mindset. Having that mindset will not get you where you want to be. To start one must learn to NOT make excuses, own up their mistakes and learn from them.\"), mdx(\"li\", {\n    parentName: \"ul\"\n  }, mdx(\"strong\", {\n    parentName: \"li\"\n  }, \"Setting and achieving daily goals\"), \": To ensure one is on track, one must break the goal to the achievable measurable smaller goals. That is where setting daily income goals (D.I.G.) comes into play. D.I.G. will not always be measurable, especially when building a brand or investing in things that don't return a dollar amount. One should also have weekly and monthly goals in addition to the daily goals.\")), mdx(Gallery, {\n    photos: [{\n      src: DIG1,\n      width: 6,\n      height: 4\n    }, {\n      src: DIG2,\n      width: 2,\n      height: 4\n    }],\n    mdxType: \"Gallery\"\n  }), mdx(\"p\", null, \"To set the daily income goals, start with yearly goal then calculate how much you need to make an hour. Then take that number multiply it by 3, since you will have unproductive hours.\"), mdx(\"ul\", null, mdx(\"li\", {\n    parentName: \"ul\"\n  }, mdx(\"strong\", {\n    parentName: \"li\"\n  }, \"Value your time and focus on the things that will get you where want to be\"), \": Don\\u2019t try to do everything! Focus on personal strengths and growing them, rather than trying to be good at everything. To help address the weaknesses leverage others\\u2019 strengths.\"), mdx(\"li\", {\n    parentName: \"ul\"\n  }, mdx(\"strong\", {\n    parentName: \"li\"\n  }, \"Manage time\"), \": One mistake that many people do (including me) is undervaluing time! Based on the calculation above, if an hour is worth $171 dollars, it makes no sense for me to mow the lawn. Especially, when I can pay someone $20 an hour to take care of it.\")), mdx(\"blockquote\", null, mdx(\"p\", {\n    parentName: \"blockquote\"\n  }, \"\\u201CRich people value time. Poor people value stuff\\u201D\"), mdx(\"p\", {\n    parentName: \"blockquote\"\n  }, \"\\u2014 Page 197\")), mdx(\"ul\", null, mdx(\"li\", {\n    parentName: \"ul\"\n  }, mdx(\"strong\", {\n    parentName: \"li\"\n  }, \"Write down every single activity you do\"), \": Writing everything down, from brushing your teeth, making the bed, to sleeping. This exercise will allow you to identify how much time you spend and where. Evaluate every activity and identify if it is helping to get you to where you need to be or not. If not, it is time to change it. Additionally, this will allow you to prioritize your activities.\")), mdx(\"hr\", null), mdx(\"h3\", {\n    \"id\": \"the-fu-money-business\"\n  }, mdx(\"a\", _extends({\n    parentName: \"h3\"\n  }, {\n    \"href\": \"#the-fu-money-business\",\n    \"aria-label\": \"the fu money business permalink\",\n    \"className\": \"anchor\"\n  }), mdx(\"svg\", _extends({\n    parentName: \"a\"\n  }, {\n    \"aria-hidden\": \"true\",\n    \"focusable\": \"false\",\n    \"height\": \"16\",\n    \"version\": \"1.1\",\n    \"viewBox\": \"0 0 16 16\",\n    \"width\": \"16\"\n  }), mdx(\"path\", _extends({\n    parentName: \"svg\"\n  }, {\n    \"fillRule\": \"evenodd\",\n    \"d\": \"M4 9h1v1H4c-1.5 0-3-1.69-3-3.5S2.55 3 4 3h4c1.45 0 3 1.69 3 3.5 0 1.41-.91 2.72-2 3.25V8.59c.58-.45 1-1.27 1-2.09C10 5.22 8.98 4 8 4H4c-.98 0-2 1.22-2 2.5S3 9 4 9zm9-3h-1v1h1c1 0 2 1.22 2 2.5S13.98 12 13 12H9c-.98 0-2-1.22-2-2.5 0-.83.42-1.64 1-2.09V6.25c-1.09.53-2 1.84-2 3.25C6 11.31 7.55 13 9 13h4c1.45 0 3-1.69 3-3.5S14.5 6 13 6z\"\n  })))), \"The F.U. Money Business\"), mdx(\"p\", null, \"To build a successful business, the person must be focused on the business not the hot product that everyone is talking about. Have a vision and leverage the strengths of others to achieve it. Most importantly the person must not be an opportunity seeker! Opportunity seeker is someone who does not have a strategy and is just looking to make money quickly.\"), mdx(\"p\", null, mdx(\"figure\", _extends({\n    parentName: \"p\"\n  }, {\n    \"className\": \"gatsby-resp-image-figure\",\n    \"style\": {}\n  }), \"\\n    \", mdx(\"a\", _extends({\n    parentName: \"figure\"\n  }, {\n    \"className\": \"gatsby-resp-image-link\",\n    \"href\": \"/static/e60eeb30e4117a90988345277a544f76/74a01/questions.png\",\n    \"style\": {\n      \"display\": \"block\"\n    },\n    \"target\": \"_blank\",\n    \"rel\": [\"noopener\"]\n  }), \"\\n    \", mdx(\"span\", _extends({\n    parentName: \"a\"\n  }, {\n    \"className\": \"gatsby-resp-image-wrapper\",\n    \"style\": {\n      \"position\": \"relative\",\n      \"display\": \"block\",\n      \"marginLeft\": \"auto\",\n      \"marginRight\": \"auto\",\n      \"maxWidth\": \"464px\"\n    }\n  }), \"\\n    \", mdx(\"span\", _extends({\n    parentName: \"span\"\n  }, {\n    \"className\": \"gatsby-resp-image-background-image\",\n    \"style\": {\n      \"paddingBottom\": \"142.02586206896552%\",\n      \"position\": \"relative\",\n      \"bottom\": \"0px\",\n      \"left\": \"0px\",\n      \"backgroundSize\": \"cover\",\n      \"display\": \"block\"\n    }\n  })), \"\\n    \", mdx(\"img\", _extends({\n    parentName: \"span\"\n  }, {\n    \"className\": \"gatsby-resp-image-image\",\n    \"style\": {\n      \"width\": \"100%\",\n      \"height\": \"100%\",\n      \"margin\": \"0px\",\n      \"verticalAlign\": \"middle\",\n      \"position\": \"absolute\",\n      \"top\": \"0px\",\n      \"left\": \"0px\",\n      \"boxShadow\": \"inset 0px 0px 0px 400px white\"\n    },\n    \"alt\": \"questions\",\n    \"title\": \"Questions to answer before starting a business. Page 227\",\n    \"src\": \"/static/e60eeb30e4117a90988345277a544f76/74a01/questions.png\",\n    \"srcSet\": [\"/static/e60eeb30e4117a90988345277a544f76/acf4b/questions.png 173w\", \"/static/e60eeb30e4117a90988345277a544f76/fc834/questions.png 345w\", \"/static/e60eeb30e4117a90988345277a544f76/74a01/questions.png 464w\"],\n    \"sizes\": \"(max-width: 464px) 100vw, 464px\"\n  })), \"\\n  \"), \"\\n  \"), \"\\n    \", mdx(\"figcaption\", _extends({\n    parentName: \"figure\"\n  }, {\n    \"className\": \"gatsby-resp-image-figcaption\"\n  }), \"Questions to answer before starting a business. Page 227\"), \"\\n  \")), mdx(\"h3\", {\n    \"id\": \"ideal-business-characteristics\"\n  }, mdx(\"a\", _extends({\n    parentName: \"h3\"\n  }, {\n    \"href\": \"#ideal-business-characteristics\",\n    \"aria-label\": \"ideal business characteristics permalink\",\n    \"className\": \"anchor\"\n  }), mdx(\"svg\", _extends({\n    parentName: \"a\"\n  }, {\n    \"aria-hidden\": \"true\",\n    \"focusable\": \"false\",\n    \"height\": \"16\",\n    \"version\": \"1.1\",\n    \"viewBox\": \"0 0 16 16\",\n    \"width\": \"16\"\n  }), mdx(\"path\", _extends({\n    parentName: \"svg\"\n  }, {\n    \"fillRule\": \"evenodd\",\n    \"d\": \"M4 9h1v1H4c-1.5 0-3-1.69-3-3.5S2.55 3 4 3h4c1.45 0 3 1.69 3 3.5 0 1.41-.91 2.72-2 3.25V8.59c.58-.45 1-1.27 1-2.09C10 5.22 8.98 4 8 4H4c-.98 0-2 1.22-2 2.5S3 9 4 9zm9-3h-1v1h1c1 0 2 1.22 2 2.5S13.98 12 13 12H9c-.98 0-2-1.22-2-2.5 0-.83.42-1.64 1-2.09V6.25c-1.09.53-2 1.84-2 3.25C6 11.31 7.55 13 9 13h4c1.45 0 3-1.69 3-3.5S14.5 6 13 6z\"\n  })))), \"Ideal business characteristics\"), mdx(\"ol\", null, mdx(\"li\", {\n    parentName: \"ol\"\n  }, mdx(\"strong\", {\n    parentName: \"li\"\n  }, \"Do what you love\"), \": The business must be something that you love so much, that it is the only thing you would do.\"), mdx(\"li\", {\n    parentName: \"ol\"\n  }, mdx(\"strong\", {\n    parentName: \"li\"\n  }, \"Stable, growing and long-term demand\"), \": Competition is great! It means there is demand for what you will offer. The foundation of the business must include strong evidence that the market wants to pay for it, they want to pay for a solution from \", mdx(\"strong\", {\n    parentName: \"li\"\n  }, \"YOU\"), \" and your solution is brilliant when compared to competition.\"), mdx(\"li\", {\n    parentName: \"ol\"\n  }, mdx(\"strong\", {\n    parentName: \"li\"\n  }, \"Be portable\"), \": The business can be worked on from anywhere, providing the flexibility one desires.\"), mdx(\"li\", {\n    parentName: \"ol\"\n  }, mdx(\"strong\", {\n    parentName: \"li\"\n  }, \"High profit margin\"), \": The business must be profitable and set you up to achieving your goals.\"), mdx(\"li\", {\n    parentName: \"ol\"\n  }, mdx(\"strong\", {\n    parentName: \"li\"\n  }, \"Scalability\"), \": Have the potential to grow fast by adding additional streams of income.\"), mdx(\"li\", {\n    parentName: \"ol\"\n  }, mdx(\"strong\", {\n    parentName: \"li\"\n  }, \"Low cost\"), \": Be able to start the business with thousands of dollars instead of millions.\"), mdx(\"li\", {\n    parentName: \"ol\"\n  }, mdx(\"strong\", {\n    parentName: \"li\"\n  }, \"Little to no staff\"), \": Automating the business so it does not require your presence all the time. Put the right people in the right place. Take action only when needed.\"), mdx(\"li\", {\n    parentName: \"ol\"\n  }, mdx(\"strong\", {\n    parentName: \"li\"\n  }, \"Low overhead\"), \": keep the business lean and mean.\"), mdx(\"li\", {\n    parentName: \"ol\"\n  }, mdx(\"strong\", {\n    parentName: \"li\"\n  }, \"Money coming in while you sleep\"), \": Business should give you the freedom to not be there daily. You should not be exchanging hours for dollars.\")), mdx(\"blockquote\", null, mdx(\"p\", {\n    parentName: \"blockquote\"\n  }, \"\\u201CFundamentals are everything, while fads come and go. In martial art, I\\u2019ve learned that an amateur is someone who knows a thousand moves but practices each move one time. A master is someone who knows only a few moves but practices each move thousands of times. \\u201C\"), mdx(\"p\", {\n    parentName: \"blockquote\"\n  }, \"\\u2014 Page 265\")), mdx(\"hr\", null), mdx(\"h3\", {\n    \"id\": \"how-to-make-money\"\n  }, mdx(\"a\", _extends({\n    parentName: \"h3\"\n  }, {\n    \"href\": \"#how-to-make-money\",\n    \"aria-label\": \"how to make money permalink\",\n    \"className\": \"anchor\"\n  }), mdx(\"svg\", _extends({\n    parentName: \"a\"\n  }, {\n    \"aria-hidden\": \"true\",\n    \"focusable\": \"false\",\n    \"height\": \"16\",\n    \"version\": \"1.1\",\n    \"viewBox\": \"0 0 16 16\",\n    \"width\": \"16\"\n  }), mdx(\"path\", _extends({\n    parentName: \"svg\"\n  }, {\n    \"fillRule\": \"evenodd\",\n    \"d\": \"M4 9h1v1H4c-1.5 0-3-1.69-3-3.5S2.55 3 4 3h4c1.45 0 3 1.69 3 3.5 0 1.41-.91 2.72-2 3.25V8.59c.58-.45 1-1.27 1-2.09C10 5.22 8.98 4 8 4H4c-.98 0-2 1.22-2 2.5S3 9 4 9zm9-3h-1v1h1c1 0 2 1.22 2 2.5S13.98 12 13 12H9c-.98 0-2-1.22-2-2.5 0-.83.42-1.64 1-2.09V6.25c-1.09.53-2 1.84-2 3.25C6 11.31 7.55 13 9 13h4c1.45 0 3-1.69 3-3.5S14.5 6 13 6z\"\n  })))), \"How to make money?\"), mdx(\"p\", null, \"The answer is simple. Knowing and understanding the market is the most important thing. It is more important than the products or services being sold. No matter how great the product or service is, if it does not address the market\\u2019s need. To be successful in any market one must fundamentally understand it to dominate it.\"));\n}\nMDXContent.isMDXComponent = true;"},"timeToRead":6,"excerpt":"Introduction This was an unplanned read! Although my to-read booklist is full of books to go through, this book ended up being the firstâ€¦","frontmatter":{"title":"F.U. Money","coverURL":"","coverFile":{"publicURL":"/static/fuMoney-6463c0453e954c7d5953fec98345751f.png"},"date":"January 21, 2019","author":"Fadee Kannah","authorTwitter":"@fadeenk","publisher":"MrKannah.com","dateModified":"2019-02-24T00:00:00.000Z","category":"Books","tags":["Business","Entrepreneurship","StartUps","Money"]},"fields":{"slug":"/f-u-money","date":"2019-01-21T08:00:00.000Z"}}},"pageContext":{"isCreatedByStatefulCreatePages":false,"slug":"/f-u-money"}}