{"data":{"mdx":{"code":{"body":"function _extends() { _extends = Object.assign || function (target) { for (var i = 1; i < arguments.length; i++) { var source = arguments[i]; for (var key in source) { if (Object.prototype.hasOwnProperty.call(source, key)) { target[key] = source[key]; } } } return target; }; return _extends.apply(this, arguments); }\n\nfunction _objectWithoutProperties(source, excluded) { if (source == null) return {}; var target = _objectWithoutPropertiesLoose(source, excluded); var key, i; if (Object.getOwnPropertySymbols) { var sourceSymbolKeys = Object.getOwnPropertySymbols(source); for (i = 0; i < sourceSymbolKeys.length; i++) { key = sourceSymbolKeys[i]; if (excluded.indexOf(key) >= 0) continue; if (!Object.prototype.propertyIsEnumerable.call(source, key)) continue; target[key] = source[key]; } } return target; }\n\nfunction _objectWithoutPropertiesLoose(source, excluded) { if (source == null) return {}; var target = {}; var sourceKeys = Object.keys(source); var key, i; for (i = 0; i < sourceKeys.length; i++) { key = sourceKeys[i]; if (excluded.indexOf(key) >= 0) continue; target[key] = source[key]; } return target; }\n\n/* @jsx mdx */\nvar _frontmatter = {\n  \"title\": \"Blitzscaling Your API - Lessons Learned After Building over 400 Integrations\",\n  \"coverFile\": \"./DevelopersWorkflow.jpg\",\n  \"coverURL\": \"\",\n  \"author\": \"Fadee Kannah\",\n  \"authorTwitter\": \"@fadeenk\",\n  \"publisher\": \"MrKannah.com\",\n  \"dateModified\": \"2019-03-02T00:00:00.000Z\",\n  \"date\": \"2019-02-21T00:00:00.000Z\",\n  \"completed\": \"2019-03-02T00:00:00.000Z\",\n  \"category\": \"Talks\",\n  \"tags\": [\"DevWeek2019\", \"Development\", \"API\", \"Architecture\"]\n};\n\nvar makeShortcode = function makeShortcode(name) {\n  return function MDXDefaultShortcode(props) {\n    console.warn(\"Component \" + name + \" was not imported, exported, or provided by MDXProvider as global scope\");\n    return mdx(\"div\", props);\n  };\n};\n\nvar layoutProps = {\n  _frontmatter: _frontmatter\n};\nvar MDXLayout = \"wrapper\";\nreturn function MDXContent(_ref) {\n  var components = _ref.components,\n      props = _objectWithoutProperties(_ref, [\"components\"]);\n\n  return mdx(MDXLayout, _extends({}, layoutProps, props, {\n    components: components,\n    mdxType: \"MDXLayout\"\n  }), mdx(\"h2\", {\n    \"id\": \"introduction\"\n  }, mdx(\"a\", _extends({\n    parentName: \"h2\"\n  }, {\n    \"href\": \"#introduction\",\n    \"aria-label\": \"introduction permalink\",\n    \"className\": \"anchor\"\n  }), mdx(\"svg\", _extends({\n    parentName: \"a\"\n  }, {\n    \"aria-hidden\": \"true\",\n    \"focusable\": \"false\",\n    \"height\": \"16\",\n    \"version\": \"1.1\",\n    \"viewBox\": \"0 0 16 16\",\n    \"width\": \"16\"\n  }), mdx(\"path\", _extends({\n    parentName: \"svg\"\n  }, {\n    \"fillRule\": \"evenodd\",\n    \"d\": \"M4 9h1v1H4c-1.5 0-3-1.69-3-3.5S2.55 3 4 3h4c1.45 0 3 1.69 3 3.5 0 1.41-.91 2.72-2 3.25V8.59c.58-.45 1-1.27 1-2.09C10 5.22 8.98 4 8 4H4c-.98 0-2 1.22-2 2.5S3 9 4 9zm9-3h-1v1h1c1 0 2 1.22 2 2.5S13.98 12 13 12H9c-.98 0-2-1.22-2-2.5 0-.83.42-1.64 1-2.09V6.25c-1.09.53-2 1.84-2 3.25C6 11.31 7.55 13 9 13h4c1.45 0 3-1.69 3-3.5S14.5 6 13 6z\"\n  })))), \"Introduction\"), mdx(\"p\", null, \"This talk was hosted during the Developer Week 2019 conference. I attended this talk to learn about building APIs for integrations. This is important since in today's world data is being shared between many services. \"), mdx(\"h2\", {\n    \"id\": \"presenters\"\n  }, mdx(\"a\", _extends({\n    parentName: \"h2\"\n  }, {\n    \"href\": \"#presenters\",\n    \"aria-label\": \"presenters permalink\",\n    \"className\": \"anchor\"\n  }), mdx(\"svg\", _extends({\n    parentName: \"a\"\n  }, {\n    \"aria-hidden\": \"true\",\n    \"focusable\": \"false\",\n    \"height\": \"16\",\n    \"version\": \"1.1\",\n    \"viewBox\": \"0 0 16 16\",\n    \"width\": \"16\"\n  }), mdx(\"path\", _extends({\n    parentName: \"svg\"\n  }, {\n    \"fillRule\": \"evenodd\",\n    \"d\": \"M4 9h1v1H4c-1.5 0-3-1.69-3-3.5S2.55 3 4 3h4c1.45 0 3 1.69 3 3.5 0 1.41-.91 2.72-2 3.25V8.59c.58-.45 1-1.27 1-2.09C10 5.22 8.98 4 8 4H4c-.98 0-2 1.22-2 2.5S3 9 4 9zm9-3h-1v1h1c1 0 2 1.22 2 2.5S13.98 12 13 12H9c-.98 0-2-1.22-2-2.5 0-.83.42-1.64 1-2.09V6.25c-1.09.53-2 1.84-2 3.25C6 11.31 7.55 13 9 13h4c1.45 0 3-1.69 3-3.5S14.5 6 13 6z\"\n  })))), \"Presenters\"), mdx(\"p\", null, \"This talk was presented by two product managers (Shivin Bakshi and Conor Delahunty) from Trulioo. Shivin has been involved in championing integration of 40+ data sources, release management of SDKs, and managing Trulioo\\u2019s document verification technology. Conor is responsible for the development of Trulioo\\u2019s developer hub and expanding their developer ecosystem as well as integrating APIs from across the world.\"), mdx(\"h2\", {\n    \"id\": \"summary\"\n  }, mdx(\"a\", _extends({\n    parentName: \"h2\"\n  }, {\n    \"href\": \"#summary\",\n    \"aria-label\": \"summary permalink\",\n    \"className\": \"anchor\"\n  }), mdx(\"svg\", _extends({\n    parentName: \"a\"\n  }, {\n    \"aria-hidden\": \"true\",\n    \"focusable\": \"false\",\n    \"height\": \"16\",\n    \"version\": \"1.1\",\n    \"viewBox\": \"0 0 16 16\",\n    \"width\": \"16\"\n  }), mdx(\"path\", _extends({\n    parentName: \"svg\"\n  }, {\n    \"fillRule\": \"evenodd\",\n    \"d\": \"M4 9h1v1H4c-1.5 0-3-1.69-3-3.5S2.55 3 4 3h4c1.45 0 3 1.69 3 3.5 0 1.41-.91 2.72-2 3.25V8.59c.58-.45 1-1.27 1-2.09C10 5.22 8.98 4 8 4H4c-.98 0-2 1.22-2 2.5S3 9 4 9zm9-3h-1v1h1c1 0 2 1.22 2 2.5S13.98 12 13 12H9c-.98 0-2-1.22-2-2.5 0-.83.42-1.64 1-2.09V6.25c-1.09.53-2 1.84-2 3.25C6 11.31 7.55 13 9 13h4c1.45 0 3-1.69 3-3.5S14.5 6 13 6z\"\n  })))), \"Summary\"), mdx(\"p\", null, \"When building APIs field names are extremely important. The filed names should match business logic not internal system names.\"), mdx(\"p\", null, mdx(\"strong\", {\n    parentName: \"p\"\n  }, \"Example\"), \"\\nUsing \", mdx(\"code\", _extends({\n    parentName: \"p\"\n  }, {\n    \"className\": \"language-text\"\n  }), \"name\"), \" as a data field name in the API is bad, because it can be a user's name or business's name and so on... Instead use nested data as user and business and in it define the name field.\"), mdx(\"div\", {\n    \"className\": \"gatsby-highlight\",\n    \"data-language\": \"xml\"\n  }, mdx(\"pre\", _extends({\n    parentName: \"div\"\n  }, {\n    \"className\": \"language-xml\"\n  }), mdx(\"code\", _extends({\n    parentName: \"pre\"\n  }, {\n    \"className\": \"language-xml\"\n  }), mdx(\"span\", _extends({\n    parentName: \"code\"\n  }, {\n    \"className\": \"token tag\"\n  }), mdx(\"span\", _extends({\n    parentName: \"span\"\n  }, {\n    \"className\": \"token tag\"\n  }), mdx(\"span\", _extends({\n    parentName: \"span\"\n  }, {\n    \"className\": \"token punctuation\"\n  }), \"<\"), \"data\"), mdx(\"span\", _extends({\n    parentName: \"span\"\n  }, {\n    \"className\": \"token punctuation\"\n  }), \">\")), \"\\n    \", mdx(\"span\", _extends({\n    parentName: \"code\"\n  }, {\n    \"className\": \"token tag\"\n  }), mdx(\"span\", _extends({\n    parentName: \"span\"\n  }, {\n    \"className\": \"token tag\"\n  }), mdx(\"span\", _extends({\n    parentName: \"span\"\n  }, {\n    \"className\": \"token punctuation\"\n  }), \"<\"), \"user\"), mdx(\"span\", _extends({\n    parentName: \"span\"\n  }, {\n    \"className\": \"token punctuation\"\n  }), \">\")), \"\\n        \", mdx(\"span\", _extends({\n    parentName: \"code\"\n  }, {\n    \"className\": \"token tag\"\n  }), mdx(\"span\", _extends({\n    parentName: \"span\"\n  }, {\n    \"className\": \"token tag\"\n  }), mdx(\"span\", _extends({\n    parentName: \"span\"\n  }, {\n    \"className\": \"token punctuation\"\n  }), \"<\"), \"name\"), mdx(\"span\", _extends({\n    parentName: \"span\"\n  }, {\n    \"className\": \"token punctuation\"\n  }), \">\")), \"Test\", mdx(\"span\", _extends({\n    parentName: \"code\"\n  }, {\n    \"className\": \"token tag\"\n  }), mdx(\"span\", _extends({\n    parentName: \"span\"\n  }, {\n    \"className\": \"token tag\"\n  }), mdx(\"span\", _extends({\n    parentName: \"span\"\n  }, {\n    \"className\": \"token punctuation\"\n  }), \"</\"), \"name\"), mdx(\"span\", _extends({\n    parentName: \"span\"\n  }, {\n    \"className\": \"token punctuation\"\n  }), \">\")), \"\\n    \", mdx(\"span\", _extends({\n    parentName: \"code\"\n  }, {\n    \"className\": \"token tag\"\n  }), mdx(\"span\", _extends({\n    parentName: \"span\"\n  }, {\n    \"className\": \"token tag\"\n  }), mdx(\"span\", _extends({\n    parentName: \"span\"\n  }, {\n    \"className\": \"token punctuation\"\n  }), \"</\"), \"user\"), mdx(\"span\", _extends({\n    parentName: \"span\"\n  }, {\n    \"className\": \"token punctuation\"\n  }), \">\")), \"\\n    \", mdx(\"span\", _extends({\n    parentName: \"code\"\n  }, {\n    \"className\": \"token tag\"\n  }), mdx(\"span\", _extends({\n    parentName: \"span\"\n  }, {\n    \"className\": \"token tag\"\n  }), mdx(\"span\", _extends({\n    parentName: \"span\"\n  }, {\n    \"className\": \"token punctuation\"\n  }), \"<\"), \"business\"), mdx(\"span\", _extends({\n    parentName: \"span\"\n  }, {\n    \"className\": \"token punctuation\"\n  }), \">\")), \"\\n        \", mdx(\"span\", _extends({\n    parentName: \"code\"\n  }, {\n    \"className\": \"token tag\"\n  }), mdx(\"span\", _extends({\n    parentName: \"span\"\n  }, {\n    \"className\": \"token tag\"\n  }), mdx(\"span\", _extends({\n    parentName: \"span\"\n  }, {\n    \"className\": \"token punctuation\"\n  }), \"<\"), \"name\"), mdx(\"span\", _extends({\n    parentName: \"span\"\n  }, {\n    \"className\": \"token punctuation\"\n  }), \">\")), \"company\", mdx(\"span\", _extends({\n    parentName: \"code\"\n  }, {\n    \"className\": \"token tag\"\n  }), mdx(\"span\", _extends({\n    parentName: \"span\"\n  }, {\n    \"className\": \"token tag\"\n  }), mdx(\"span\", _extends({\n    parentName: \"span\"\n  }, {\n    \"className\": \"token punctuation\"\n  }), \"</\"), \"name\"), mdx(\"span\", _extends({\n    parentName: \"span\"\n  }, {\n    \"className\": \"token punctuation\"\n  }), \">\")), \"\\n    \", mdx(\"span\", _extends({\n    parentName: \"code\"\n  }, {\n    \"className\": \"token tag\"\n  }), mdx(\"span\", _extends({\n    parentName: \"span\"\n  }, {\n    \"className\": \"token tag\"\n  }), mdx(\"span\", _extends({\n    parentName: \"span\"\n  }, {\n    \"className\": \"token punctuation\"\n  }), \"</\"), \"business\"), mdx(\"span\", _extends({\n    parentName: \"span\"\n  }, {\n    \"className\": \"token punctuation\"\n  }), \">\")), \"\\n\", mdx(\"span\", _extends({\n    parentName: \"code\"\n  }, {\n    \"className\": \"token tag\"\n  }), mdx(\"span\", _extends({\n    parentName: \"span\"\n  }, {\n    \"className\": \"token tag\"\n  }), mdx(\"span\", _extends({\n    parentName: \"span\"\n  }, {\n    \"className\": \"token punctuation\"\n  }), \"</\"), \"data\"), mdx(\"span\", _extends({\n    parentName: \"span\"\n  }, {\n    \"className\": \"token punctuation\"\n  }), \">\"))))), mdx(\"p\", null, \"Another good practice is to research competitive APIs. This will allow you to learn what to expect and what to account for when building the APIs. \"), mdx(\"p\", null, \"Building APIs is just building another product for a customer. The APIs are the product and the customer is the developer. To ensure the APIs build are the successful focus on the costumer, which is the developers.\"), mdx(\"h3\", {\n    \"id\": \"developers-workflow\"\n  }, mdx(\"a\", _extends({\n    parentName: \"h3\"\n  }, {\n    \"href\": \"#developers-workflow\",\n    \"aria-label\": \"developers workflow permalink\",\n    \"className\": \"anchor\"\n  }), mdx(\"svg\", _extends({\n    parentName: \"a\"\n  }, {\n    \"aria-hidden\": \"true\",\n    \"focusable\": \"false\",\n    \"height\": \"16\",\n    \"version\": \"1.1\",\n    \"viewBox\": \"0 0 16 16\",\n    \"width\": \"16\"\n  }), mdx(\"path\", _extends({\n    parentName: \"svg\"\n  }, {\n    \"fillRule\": \"evenodd\",\n    \"d\": \"M4 9h1v1H4c-1.5 0-3-1.69-3-3.5S2.55 3 4 3h4c1.45 0 3 1.69 3 3.5 0 1.41-.91 2.72-2 3.25V8.59c.58-.45 1-1.27 1-2.09C10 5.22 8.98 4 8 4H4c-.98 0-2 1.22-2 2.5S3 9 4 9zm9-3h-1v1h1c1 0 2 1.22 2 2.5S13.98 12 13 12H9c-.98 0-2-1.22-2-2.5 0-.83.42-1.64 1-2.09V6.25c-1.09.53-2 1.84-2 3.25C6 11.31 7.55 13 9 13h4c1.45 0 3-1.69 3-3.5S14.5 6 13 6z\"\n  })))), \"Developers Workflow\"), mdx(\"p\", null, mdx(\"a\", _extends({\n    parentName: \"p\"\n  }, {\n    \"className\": \"gatsby-resp-image-link\",\n    \"href\": \"/static/c6856d00aecf4d0b66065fa31550eb2f/7fd22/DevelopersWorkflow.jpg\",\n    \"style\": {\n      \"display\": \"block\"\n    },\n    \"target\": \"_blank\",\n    \"rel\": [\"noopener\"]\n  }), \"\\n    \", mdx(\"span\", _extends({\n    parentName: \"a\"\n  }, {\n    \"className\": \"gatsby-resp-image-wrapper\",\n    \"style\": {\n      \"position\": \"relative\",\n      \"display\": \"block\",\n      \"marginLeft\": \"auto\",\n      \"marginRight\": \"auto\",\n      \"maxWidth\": \"690px\"\n    }\n  }), \"\\n    \", mdx(\"span\", _extends({\n    parentName: \"span\"\n  }, {\n    \"className\": \"gatsby-resp-image-background-image\",\n    \"style\": {\n      \"paddingBottom\": \"63.802083333333336%\",\n      \"position\": \"relative\",\n      \"bottom\": \"0px\",\n      \"left\": \"0px\",\n      \"backgroundSize\": \"cover\",\n      \"display\": \"block\"\n    }\n  })), \"\\n    \", mdx(\"img\", _extends({\n    parentName: \"span\"\n  }, {\n    \"className\": \"gatsby-resp-image-image\",\n    \"style\": {\n      \"width\": \"100%\",\n      \"height\": \"100%\",\n      \"margin\": \"0px\",\n      \"verticalAlign\": \"middle\",\n      \"position\": \"absolute\",\n      \"top\": \"0px\",\n      \"left\": \"0px\",\n      \"boxShadow\": \"inset 0px 0px 0px 400px white\"\n    },\n    \"alt\": \"DevelopersWorkflow\",\n    \"title\": \"\",\n    \"src\": \"/static/c6856d00aecf4d0b66065fa31550eb2f/8c996/DevelopersWorkflow.jpg\",\n    \"srcSet\": [\"/static/c6856d00aecf4d0b66065fa31550eb2f/6f483/DevelopersWorkflow.jpg 173w\", \"/static/c6856d00aecf4d0b66065fa31550eb2f/0fa0d/DevelopersWorkflow.jpg 345w\", \"/static/c6856d00aecf4d0b66065fa31550eb2f/8c996/DevelopersWorkflow.jpg 690w\", \"/static/c6856d00aecf4d0b66065fa31550eb2f/7fd22/DevelopersWorkflow.jpg 768w\"],\n    \"sizes\": \"(max-width: 690px) 100vw, 690px\"\n  })), \"\\n  \"), \"\\n  \"), \"\\n1. Starting out\"), mdx(\"ul\", null, mdx(\"li\", {\n    parentName: \"ul\"\n  }, \"Understanding the dev portal: Help the developers understand where all the resources available to them are and how to access them. Ensure the documentation is available and easily accessible.\"), mdx(\"li\", {\n    parentName: \"ul\"\n  }, \"Keys & Authentication: Provide the developers with access and credentials to access the apis.\"), mdx(\"li\", {\n    parentName: \"ul\"\n  }, \"Product overview: Ensure the developers understand what they are integrating and know the business logic they are planning to integrate.\")), mdx(\"ol\", null, mdx(\"li\", {\n    parentName: \"ol\"\n  }, \"Making a Test Verification\", mdx(\"ul\", {\n    parentName: \"li\"\n  }, mdx(\"li\", {\n    parentName: \"ul\"\n  }, \"Sandbox: Provide a testing/staging environment for the developer to test the integration without affecting production data.\"), mdx(\"li\", {\n    parentName: \"ul\"\n  }, \"Test Entities: Provide the developer with testing data.\"), mdx(\"li\", {\n    parentName: \"ul\"\n  }, \"Quick Starts: Offer guides for the developer to implement simple integration with the system\"))), mdx(\"li\", {\n    parentName: \"ol\"\n  }, \"Building Your Production Integration\", mdx(\"ul\", {\n    parentName: \"li\"\n  }, mdx(\"li\", {\n    parentName: \"ul\"\n  }, \"Integration & Best Practices: Ensure the developer is following the best practices to solve the use case. Guide them through the process to ensure no mistakes are made during the integration.\"), mdx(\"li\", {\n    parentName: \"ul\"\n  }, \"Live API Credentials: Provide production credentials so the integration can go live.\"), mdx(\"li\", {\n    parentName: \"ul\"\n  }, \"Go Live: Help the developers go live if needed and monitor things to ensure everything works as planned.\"))), mdx(\"li\", {\n    parentName: \"ol\"\n  }, \"Continued Support: Ensure developers are aware of updates and changes and have access to all the documentation as well as access to monitoring data.\")), mdx(\"h3\", {\n    \"id\": \"developer-focused-documentation\"\n  }, mdx(\"a\", _extends({\n    parentName: \"h3\"\n  }, {\n    \"href\": \"#developer-focused-documentation\",\n    \"aria-label\": \"developer focused documentation permalink\",\n    \"className\": \"anchor\"\n  }), mdx(\"svg\", _extends({\n    parentName: \"a\"\n  }, {\n    \"aria-hidden\": \"true\",\n    \"focusable\": \"false\",\n    \"height\": \"16\",\n    \"version\": \"1.1\",\n    \"viewBox\": \"0 0 16 16\",\n    \"width\": \"16\"\n  }), mdx(\"path\", _extends({\n    parentName: \"svg\"\n  }, {\n    \"fillRule\": \"evenodd\",\n    \"d\": \"M4 9h1v1H4c-1.5 0-3-1.69-3-3.5S2.55 3 4 3h4c1.45 0 3 1.69 3 3.5 0 1.41-.91 2.72-2 3.25V8.59c.58-.45 1-1.27 1-2.09C10 5.22 8.98 4 8 4H4c-.98 0-2 1.22-2 2.5S3 9 4 9zm9-3h-1v1h1c1 0 2 1.22 2 2.5S13.98 12 13 12H9c-.98 0-2-1.22-2-2.5 0-.83.42-1.64 1-2.09V6.25c-1.09.53-2 1.84-2 3.25C6 11.31 7.55 13 9 13h4c1.45 0 3-1.69 3-3.5S14.5 6 13 6z\"\n  })))), \"Developer focused documentation\"), mdx(\"ul\", null, mdx(\"li\", {\n    parentName: \"ul\"\n  }, \"All documentation should be available online\", mdx(\"ul\", {\n    parentName: \"li\"\n  }, mdx(\"li\", {\n    parentName: \"ul\"\n  }, \"Use swagger for documentation and swagger-diff for managing updates and different api versions\"))), mdx(\"li\", {\n    parentName: \"ul\"\n  }, \"Make it interactive: allow the developers to test in the documentation directly.\")), mdx(\"h3\", {\n    \"id\": \"api-design\"\n  }, mdx(\"a\", _extends({\n    parentName: \"h3\"\n  }, {\n    \"href\": \"#api-design\",\n    \"aria-label\": \"api design permalink\",\n    \"className\": \"anchor\"\n  }), mdx(\"svg\", _extends({\n    parentName: \"a\"\n  }, {\n    \"aria-hidden\": \"true\",\n    \"focusable\": \"false\",\n    \"height\": \"16\",\n    \"version\": \"1.1\",\n    \"viewBox\": \"0 0 16 16\",\n    \"width\": \"16\"\n  }), mdx(\"path\", _extends({\n    parentName: \"svg\"\n  }, {\n    \"fillRule\": \"evenodd\",\n    \"d\": \"M4 9h1v1H4c-1.5 0-3-1.69-3-3.5S2.55 3 4 3h4c1.45 0 3 1.69 3 3.5 0 1.41-.91 2.72-2 3.25V8.59c.58-.45 1-1.27 1-2.09C10 5.22 8.98 4 8 4H4c-.98 0-2 1.22-2 2.5S3 9 4 9zm9-3h-1v1h1c1 0 2 1.22 2 2.5S13.98 12 13 12H9c-.98 0-2-1.22-2-2.5 0-.83.42-1.64 1-2.09V6.25c-1.09.53-2 1.84-2 3.25C6 11.31 7.55 13 9 13h4c1.45 0 3-1.69 3-3.5S14.5 6 13 6z\"\n  })))), \"API Design\"), mdx(\"ul\", null, mdx(\"li\", {\n    parentName: \"ul\"\n  }, \"Flexible design: Apis should be designed so they are flexible and extendable\"), mdx(\"li\", {\n    parentName: \"ul\"\n  }, \"Api should be for both human and machines: Should be easy for human to read and easy for machines to process.\"), mdx(\"li\", {\n    parentName: \"ul\"\n  }, \"Support the customers: It should always be clear to the customer what the API is and what it does. \")));\n}\nMDXContent.isMDXComponent = true;"},"timeToRead":2,"excerpt":"Introduction This talk was hosted during the Developer Week 2019 conference. I attended this talk to learn about building APIs forâ€¦","frontmatter":{"title":"Blitzscaling Your API - Lessons Learned After Building over 400 Integrations","coverURL":"","coverFile":{"publicURL":"/static/DevelopersWorkflow-c6856d00aecf4d0b66065fa31550eb2f.jpg"},"date":"February 21, 2019","author":"Fadee Kannah","authorTwitter":"@fadeenk","publisher":"MrKannah.com","dateModified":"2019-03-02T00:00:00.000Z","category":"Talks","tags":["DevWeek2019","Development","API","Architecture"]},"fields":{"slug":"/blitzscaling-your-api-lessons-learned-after-building-over-400-integrations","date":"2019-02-21T08:00:00.000Z"}}},"pageContext":{"isCreatedByStatefulCreatePages":false,"slug":"/blitzscaling-your-api-lessons-learned-after-building-over-400-integrations"}}